Title,Political Lean,Score,Text
Biden dice antes del discurso sobre el Estado de la Unión que la unidad de la OTAN y Occidente da a EEUU el poder de imponer consecuencias a Putin,Liberal,57,
Declaración conjunta de los partidos comunistas y obreros: ¡No a la guerra imperialista en Ucrania!,Liberal,1,
Los progresistas luchan por influencia entre los demócratas de California,Liberal,59,
Liberal,Liberal,0,
Sólo el anticapitalismo puede salvar el planeta,Liberal,36,
¿Alguien sabe si hay diferencias importantes entre la versión original y la revisada de ‘Che Guevara: Una vida revolucionaria’?,Liberal,2,"Los moderadores pueden eliminar esta publicación si no les parece apropiada.

He estado leyendo la versión original de este libro y estoy a mitad de camino, pero desafortunadamente se derramó una bebida sobre él y básicamente está arruinado. Las versiones disponibles que veo en eBay y demás son todas la versión revisada de 2010. Tengo una buena cantidad de notas que simplemente iba a copiar en mi próxima copia, pero no estoy seguro de qué tan bien coinciden las páginas y todo lo demás, cuánta información se eliminó o agregó, etc. Sé que es una posibilidad remota, pero ¿alguien sabe las diferencias entre las dos además de la nueva introducción del autor?"
La respuesta de Biden a la invasión de Ucrania por parte de Putin ha sido su mejor momento,Liberal,342,
Apoyar a Ucrania tendrá consecuencias económicas para todos nosotros. Vale la pena.,Liberal,502,
"""Hablar de los conflictos y de la guerra como si fuera algo natural cuando se trata de ciertos países, ciertas culturas y ciertas etnias es la esencia misma del racismo.""",Liberal,3600,
¿Cuándo reconocerá la ley que los hombres que se consideran inseguros al estar cerca de sus parejas también son inseguros al estar cerca de sus hijos?,Liberal,134,
¡Guerra de clases contra guerra imperialista! | Poder Obrero,Liberal,0,
Liberal,Liberal,32,
Cinco cosas a tener en cuenta en las elecciones primarias de Texas,Liberal,2,
"Sindicato parlamentario en Recreational Equipment, Inc. (REI)",Liberal,20,
El putinismo se gesta en el seno del Partido Republicano,Liberal,105,
Hacia la historia de la disidencia maoísta en la Unión Soviética -artículo de Alexei Volynets. Segunda parte,Liberal,5,
Los nazis salen de la nada.,Liberal,498,
"Cómo Estados Unidos alimenta a los niños en África, pero no en su país",Liberal,0,
El trabajador de Virginia: sindicalismo de lucha de clases,Liberal,16,
El santo patrón de las presidencias estancadas: lo que Joe Biden puede aprender de Harry Truman,Liberal,2,
Una de las mejores comedias de situación de todos los tiempos.,Liberal,338,
"República Checa: ""Si apoya públicamente las acciones de Rusia expresadas en Internet o en cualquier otro espacio, se enfrentará a una pena de prisión de entre uno y tres años. Estamos siguiendo de cerca los casos de comentarios en Internet que expresen su apoyo a Rusia""",Liberal,24,
Definición de patriota,Liberal,2042,
¿Quién es Anasse Kazib? Conozca al trabajador ferroviario trotskista que se postula a la presidencia de Francia,Liberal,24,
¿Qué es Euromaidán?,'Las aguas están calientes': una subasta en EE. UU. abre la fiebre de la energía eólica marina,5,
Violación cínica de la legislación ucraniana,Liberal,4,
¿Cómo responderías cuando alguien publica esto en las redes sociales?,Liberal,7,
¿Cuál es su opinión sobre la sociocracia?,Liberal,4,"Ahora, antes de que todos me ataquen con un ""imposible, no existe tal cosa"", primero escúchenme (y luego pueden atacarme después, jajaja)

(Desechable porque no quiero que esto esté asociado a mi trabajo principal en caso de que mi trabajo lo encuentre alguna vez)

Actualmente trabajo en Recursos Humanos, pero prácticamente soy un principiante (y en una empresa tecnológica emergente). Lo que significa que no hago ninguna de *esas* partes de Recursos Humanos: no recibo informes de acoso, no tomo decisiones sobre salarios, no manejo disputas entre gerentes y empleados, ni siquiera me entero si un empleado ha sido despedido hasta después de que se haya tomado la decisión.

Ahora bien, obviamente, este no siempre será el caso si me quedo en Recursos Humanos; eventualmente, me ascenderán a un puesto de Gerente de Recursos Humanos donde tendría que asumir este tipo de responsabilidades. Siempre pensé que para entonces simplemente dejaría mi trabajo e iría a la escuela de posgrado para obtener un MSW o algo que no me quitara el alma del cuerpo. 

Dicho esto, después de algunas conversaciones con varias personas, comencé a preguntarme si tal vez exista otra opción aceptable, en la que me quede en Recursos Humanos, asuma responsabilidades, pero influya en la organización de maneras sutiles. Quiero decir, obviamente nunca podría convencer a ningún equipo ejecutivo o junta directiva de que abandone el capitalismo y adopte un enfoque socialista del trabajo, pero tal vez podría hacer cosas como ""estadísticas creativas"" donde nuestros puntos de referencia salariales alienten a que nuestros trabajos peor pagados sean mejor pagados, o convertirme en un defensor de las voces de los empleados, ese tipo de cosas. 

Podría ser, por así decirlo, un agente encubierto del izquierdismo, jajaja. Escondiéndome a plena vista en un departamento de Recursos Humanos cerca de ti. 

El problema es que no tengo ni idea de cómo hacer esto. Hay muchas asociaciones profesionales que podrían quererme con un mentor en el campo, pero casi seguro que no tendrían el punto de vista ideológico adecuado. Sé cómo tiende a pensar esta gente.

Si toda esta idea resulta no ser viable, probablemente simplemente reduciré mis pérdidas y cambiaré de campo antes de que sea demasiado tarde (quiero decir, sí, técnicamente seguiría sin ser capitalista ya que no poseería ningún medio de producción, pero aun así, eso no significa que me sentaría bien ser el lacayo/mono bailarín/sheriff/etc. del capitalista. La parte ACAB de mí está demasiado asustada por la idea). Pero si es posible, me encantaría intentarlo. Pero necesito un asesor, ¿sabes?

De todos modos, si alguien tiene alguna recomendación sobre cómo encontrar a mi Yoda, házmelo saber. Y si has leído todo esto y todavía piensas que es una pregunta ridícula y que no existe tal persona, sigue adelante y llámame, te lo has ganado jajaja."
"La prohibición de compraventa de acciones en el Congreso debe incluir a los cónyuges, afirman los legisladores",Liberal,906,
Me hizo nazi venir.,Liberal,584,
"La restauración del capitalismo en la Unión Soviética, de Bill Bland (1980)",Liberal,18,
Reflexiones sobre la izquierda “mala del Oeste”,¿Por qué creen ustedes que el autoritarismo y la derecha alternativa están ganando terreno?,23,
Hacia la historia de la disidencia maoísta en la Unión Soviética – un artículo de Alexei Volynets. Parte 1,Liberal,5,
"El Partido Verde de Estados Unidos sobre la crisis en Ucrania ""Rechazamos las insípidas exigencias de los políticos y medios de comunicación estadounidenses y europeos de elegir un bando u otro""",Liberal,21,
"¿El DSA cree que la OTAN causó la crisis de Ucrania? Temo que el DSA esté siendo dominado por partidarios de la extrema derecha, nacionalista y dictatorial que es Rusia. ¿Cómo pueden los izquierdistas apoyar a Rusia?",Liberal,54,Liberal
Conferencia de Richard Wolff,Liberal,9,
"De alguien cuyo país también es víctima de la constante manipulación de los medios estatales rusos, que intentan avivar las tensiones étnicas. Soy letón y mi lengua materna es el ruso. No muerdan el anzuelo de Putin.",Liberal,99,"Realmente me rompe el corazón ver a tantos supuestos ""izquierdistas"" de los EE. UU. apoyar a Putin en su guerra irredentista de agresión en Ucrania solo porque la OTAN está del otro lado, o porque se les ha engañado para que crean que las tensiones étnicas alimentadas por el Kremlin también deben ser resueltas por ellos. Realmente demuestra lo desconectados que están. Muy alejados del conflicto, probablemente demasiado jóvenes para seguir las noticias cuando ocurrió la invasión de 2014 y, además, no aprendieron nada de los libros de historia. 

Vivo en un país severamente afectado por la propaganda estatal rusa que ha estado tratando de encender tensiones étnicas entre letones y rusoparlantes desde que Putin llegó al poder. Es el tipo de manipulación más sórdido y deshonroso. 

A lo largo de los años he visto innumerables narrativas falsas propagadas por los medios estatales rusos sobre lo malvado que es nuestro gobierno y lo oprimida que supuestamente está la minoría rusa aquí. Sé que esas narrativas son falsas porque soy una minoría rusa que vive aquí. Afirman que estoy oprimido y necesito ser salvado. *No lo estoy*. **MIENTEN**. 

Lo más importante es que conozco la historia, la cultura y el contexto de lo que informan, por lo que tengo una comprensión más matizada de lo que realmente está sucediendo. Eso no quiere decir que no haya problemas, pero son lo suficientemente menores como para que se puedan resolver de manera civil y democrática. Por supuesto, sus artículos de propaganda y segmentos de noticias a menudo comienzan con una declaración verdadera, pero inmediatamente se presenta de una manera muy clara y sepultada bajo párrafos de retórica nacionalista rusa. A veces es más sutil, como ""usted es libre de sacar sus propias conclusiones"" a partir de hechos seleccionados. Intentan atraer a todo tipo de grupos demográficos con todo tipo de tácticas manipuladoras. 

En cualquier caso, su objetivo es enfrentar a los compatriotas entre sí mediante oleadas de desinformación, y luego, cuando las tensiones alcanzan un punto de ebullición, ""intervienen"" para ""salvar"" a alguien, aunque su verdadero objetivo sea lograr sus objetivos geopolíticos. Letonia podría haber corrido la misma suerte, pero en momentos como este estamos muy contentos de estar en la UE y la OTAN. 

Es una vergüenza que tantos de mis compatriotas hayan mordido el anzuelo de la narrativa de los medios estatales rusos. Sin embargo, con estas sanciones y ataques cibernéticos espero que se ponga fin a su era de mentiras.

Ojalá nuestro sistema político se libere de la política de identidad étnica y avance hacia la solución de los problemas reales con soluciones que nos beneficien a todos. Los partidos socialdemócratas reales surgirían y los partidos nacionalistas rusos y letones disminuirían.

¡Dievs svētī Latviju! Slava Ukraīni. ¡Que le jodan a Putin!"
¿Cómo es que siempre tergiversan las cosas para incluir a los “demócratas”? ¿En serio?,Liberal,347,
"DSA culpa al ""imperialismo estadounidense"" de la guerra en Ucrania y pide que se retiren de la OTAN",El socialismo podría ser necesario para ayudar a estos antivacunas atrapados en la Isla Sur de Nueva Zelanda,207,
Muere por suicidio un hombre de Pensilvania que esperaba sentencia por disturbios en el Capitolio,Liberal,164,
¿Una revolución socialdemócrata en Rusia y Bielorrusia?,Liberal,4,Liberal
Marjorie Taylor Greene resta importancia a su intervención en una conferencia fundada por nacionalistas blancos,La maternidad feliz en la Unión Soviética - Workers Today,329,
Liberal,Liberal,4,
"En la CPAC, Trump hizo una nueva y aterradora promesa a sus seguidores: lastimaré a los demócratas por ustedes.",Liberal,27,
"Mientras cientos de miles de personas huyen de Ucrania, los ciudadanos africanos están recurriendo a las redes sociales para compartir sus relatos de discriminación racial mientras intentan evacuar.",Liberal,6,
"Occidente está ganando, Rusia está perdiendo y Biden está haciendo un buen trabajo",Liberal,298,
Un poco de teoría,Liberal,0,
¿Alguien sabe qué quería decir Lenin con doctrinarismo de derecha y doctrinarismo de izquierda?,Liberal,4,"Es del libro ""El izquierdismo en el comunismo"". He leído un poco sobre el tema, pero no logro entenderlo. Me imagino que ambas son versiones del marxismo que son doctrinarias, mientras que Lenin prefería un enfoque más flexible para entender las relaciones sociales.

¿Alguna idea? Preferiría no leer el libro ahora mismo; tengo demasiadas cosas para hacer.

¡Gracias!"
Solo voy a dejar esto aquí,Liberal,730,
¿Existe una lista de lectura sobre invasiones/guerras estadounidenses y europeas?,Liberal,1,"Mi interés por la política es nuevo y, aunque he leído y oído muchas referencias a los problemas de las invasiones estadounidenses, no la he estudiado en absoluto.

Si busco en Goodreads, aparecen muchos libros al azar, pero seguramente algunos, si no la mayoría, serían libros a favor de las invasiones.

¿Hay una lista de libros que debería leer?"
Las FDI atacaron a palestinos y niños en la Puerta de Demascus. Un niño fue alcanzado por una granada aturdidora (advertencia gráfica),Liberal,723,
¿Es Volodymyr Zelensky un socialdemócrata?,Liberal,16,"Estaba leyendo la página wiki de su partido y uno de sus portavoces dijo que estaba ""a medio camino entre el liberalismo y el socialismo"". ¿Es socialdemócrata? Lo apoyo de todas formas, aunque me considere socialista. Lo siento si es una pregunta rara, pero tengo mucha curiosidad."
"Encuesta de CNN: la mayoría de los estadounidenses quieren que Estados Unidos haga más para detener a Rusia, pero la mayoría también se opone a la acción militar directa",Liberal,117,
Los papeles del Kremlin parecen mostrar un complot de Putin para llevar a Trump a la Casa Blanca | Vladimir Putin,Liberal,1198,
"Los republicanos temen la candidatura presidencial de Michelle Obama, dice un ex asesor de Trump",Liberal,91,
La libertad y la Tercera Guerra Mundial,Liberal,1,
Reflexiones sobre lo que viene después de la guerra en Ucrania,Liberal,2,"Teniendo en cuenta todo esto, ahora que la economía rusa está jodida,

Hipotéticamente, si Putin fuera derrocado y el gobierno se reestructurara, ¿la OTAN simplemente levantaría las sanciones rusas? ¿O mantendría a Rusia aislada y desestabilizada, mientras Estados Unidos y sus amigos hacen sus propias demandas y exigen un gobierno y una economía capitalistas, pro-occidentales y privatizados como compensación?

Es solo una idea."
"El primer ministro sueco Olof Palme, uno de los mayores socialistas democráticos en la historia del movimiento, fue asesinado este día, 28 de febrero de 1986, hace exactamente 36 años.",Liberal,104,
Putin revitalizó accidentalmente el orden liberal de Occidente,Liberal,548,
El esfuerzo de Trump por reescribir la historia con su apoyo a la OTAN y Ucrania,Liberal,83,
"¿Está claro? Bueno, genial, magnífico, maravilloso.",Liberal,2,"Comencé a leer un libro de introducción a la filosofía política que habla de Hobbes y su experimento mental de que un ""estado de naturaleza"", es decir, la ausencia de un estado, llevaría a una condición insegura de que cada uno se las arregle solo. No me parece que esto sea intuitivo y estoy buscando un libro que analice específicamente las formaciones no estatales en la historia de la organización social humana. ¡Gracias por cualquier pista!"
Liberal,Liberal,25,
Unidad de Pablo Neruda,Liberal,3,
"Putin, criminal de guerra. ¿Se le aplicará el mismo criterio que a Trump? 😂",Liberal,53,
Recuerden esto. No sean imbéciles con los rusos. Ellos no querían esto.,Liberal,3927,
Dejen de fingir que la izquierda está del lado de Putin,Liberal,16,
El papel de la candidatura de Poutou,Liberal,0,
Ucrania: por qué Alemania es importante,Liberal,11,
"El primer ministro sueco Olof Palme, uno de los mayores socialdemócratas en la historia de nuestro movimiento, fue asesinado este día, 28 de febrero de 1986, hace exactamente 36 años.",Liberal,221,
Prepárese para que el noreste se convierta en un país de cannabis,Liberal,27,
Cómo Tony Evers ayudó a proteger a los más vulnerables de la violencia,Liberal,8,
Keep Stories From North Korea - Mesa redonda sobre Nodutdol a las 8:00 p. m. EST el 1 de marzo con participantes anteriores de los viajes del Programa de Educación y Exposición sobre Corea (KEEP),Liberal,2,
La policía israelí golpea a una niña de 12 años en Jerusalén Este,Liberal,9170,
Esto es lo que se necesita para cambiar el funcionamiento de los tribunales de circuito de Estados Unidos,Liberal,4,
Usando una guerra para difundir chistes de criminales de guerra,Liberal,2,
Corresponsal de Fox News en el Pentágono desmonta con destreza a invitado anterior de Fox con verificación instantánea de hechos,Liberal,155,
William Barr dice que Trump habría ganado las elecciones de 2020 si hubiera “ejercido autocontrol”,Liberal,306,
"El capitalismo no tiene respuestas, pero nosotros sí: los trabajadores debemos tomar el timón y comenzar a construir un futuro socialista.",Liberal,524,
"Chris Hedges: El mayor mal es la guerra. Rusia fue incitada a la guerra, pero eso no la absuelve de su acto criminal de agresión.",Liberal,11,
¿Podemos tener una economía circular?,Liberal,10,
La guerra en Ucrania: argumentos a favor de la guerra desmentidos,Liberal,5,
Cómo responden los republicanos a la guerra de Rusia contra Ucrania: NPR,Liberal,35,
John Oliver dice que George W. Bush debería “cerrarse la boca” sobre la invasión rusa a Ucrania,Liberal,260,
Pregunta sobre la resolución de la ONU contra el nazismo contra la que votaron EEUU y Ucrania,Liberal,15,"Una afirmación común que los tankistas esgrimen es sobre la resolución de la ONU que condena el nazismo y alienta a que se tomen medidas en su contra. Por lo que sé, 130 países votaron a favor, 49 países, en su mayoría occidentales, se abstuvieron y Ucrania y los EE. UU. votaron en contra. 

Así que, si todos ustedes pueden ayudar a aclarar lo que realmente está sucediendo, ¡se los agradecería mucho! Todavía me siento profundamente en conflicto y no quiero caer en la madriguera de los tankistas."
Resumen preciso de noticias occidentales,Liberal,847,
El tiempo versus la segunda enmienda,Liberal,418,
"¡Gran energía de «¡Lo haré otra vez, joder!»!",Liberal,129,
"Plataformas de paz inmediata: Minsk II, Cartas de los cosmonautas, DSA y propuesta personal",Liberal,3,"Habiendo comparado las cuatro plataformas propuestas hasta ahora - [Minsk II](https://www.aljazeera.com/news/2022/2/9/what-is-the-minsk-agreement-and-why-is-it-relevant-now), [el camarada RF](https://cosmonautmag.com/2022/02/letter-comments-on-the-russian-threat/), [el camarada Alex](https://cosmonautmag.com/2022/02/letter-on-the-reply-to-the-russian-threat-to-freedom-and-democracy/), y [DSA](https://www.reddit.com/r/stupidpol/comments/t2wzna/on_russias_invasion_of_ukraine_democratic/), me gustaría presentar la mía a continuación, desde la perspectiva de la realpolitik geopolítica, o campismo crítico y bien informado.

**PREÁMBULO**

Considerando que es un mundo multipolar, no un mundo unipolar de hegemonía geopolítica, el que históricamente ha dado a los movimientos de clase en múltiples países impulso político en términos de lucha de clases regular,

Considerando que los países en desarrollo pueden hacer que las potencias imperialistas competidoras se enfrenten entre sí, especialmente en el comercio,

Considerando que, incluso si un mundo multipolar puede hacer más probable el gran nivelador de la guerra interimperialista, también hace más probable el gran nivelador de la revolución al desacreditar por completo al menos a una potencia imperialista,

Lo siguiente debe ser obligatorio de inmediato, fuera de un período revolucionario para la clase trabajadora, incluida la ausencia de movimientos partidistas de masas.

Lo siguiente debe ser obligatorio para todas las partes relevantes de inmediato, incluidas las potencias imperialistas del ""mal menor"".

**UCRANIA Y LA FEDERACIÓN RUSA**

- Desmovilización inmediata y completa de todas las Fuerzas Armadas de Ucrania, incluidas, entre otras, las armas pesadas y otros equipos militares

- Alto el fuego inmediato y completo por parte de las Fuerzas Armadas de la Federación Rusa

- Retirada de las armas pesadas por parte de la Federación Rusa

- Vigilancia de la OSCE

- Reforma constitucional inmediata en Ucrania, incluida la descentralización, teniendo en cuenta la República Popular de Donetsk y la República Popular de Luhansk

- Retirada por parte de la Federación Rusa del resto del equipo militar, las formaciones armadas extranjeras y los mercenarios, sujeta a la reforma constitucional antes mencionada

- Todas las demás disposiciones de Minsk II

- Diplomacia inmediata para otras condiciones de paz pertinentes

- Fin inmediato de todas las medidas represivas contra los manifestantes contra la guerra

**EE.UU. y EUROPA**

- Ninguna participación directa de los miembros de la OTAN, incluidas las zonas de exclusión aérea

- Ningún apoyo a las personas que elijan luchar por el gobierno ucraniano

- Ningún envío de armas al gobierno ucraniano Gobierno

- Abolición de todas las sanciones contra el pueblo ruso, incluidos los sectores vitales de la economía rusa

- Denuncia inmediata de las prácticas chovinistas llevadas a cabo o toleradas por Ucrania

- Aceptación inmediata de los refugiados de guerra

- Satisfacción inmediata de todos los intereses de seguridad geográficos de la Federación Rusa, por parte de todas las potencias atlantistas (EE.UU. y Europa)

- Abolición de la OTAN, posterior a la satisfacción de los intereses de seguridad antes mencionados

**¡No se debe librar ninguna guerra, excepto la guerra de clases!**"
"Plataformas de paz inmediata: Minsk II, Cartas de los cosmonautas, DSA y propuesta personal",Liberal,2,"Tras comparar las cuatro plataformas propuestas hasta ahora (Minsk II, https://www.aljazeera.com/news/2022/2/9/what-is-the-minsk-agreement-and-why-is-it-relevant-now), el camarada RF, el camarada Alex y el DSA, me gustaría presentar la mía propia a continuación, desde la perspectiva de la realpolitik geopolítica, o del campismo crítico bien informado.

**PRÉÁMBULO**

Considerando que es un mundo multipolar, no un mundo unipolar de hegemonía geopolítica, el que históricamente ha dado a los movimientos de clase en múltiples países impulso político en términos de lucha de clases regular,

Considerando que los países en desarrollo pueden hacer que las potencias imperialistas competidoras se enfrenten entre sí, especialmente en el comercio,

Considerando que, incluso si un mundo multipolar puede hacer más probable el gran nivelador de la guerra interimperialista, también hace más probable el gran nivelador de la revolución al desacreditar por completo al menos a una potencia imperialista,

Lo siguiente debe ser de obligado cumplimiento de inmediato, fuera de un período revolucionario para la clase obrera, incluida la ausencia de movimientos partidistas de masas.

Lo siguiente debe ser de obligado cumplimiento de inmediato para todas las partes pertinentes, incluidas las potencias imperialistas del ""mal menor"".

**UCRANIA Y LA FEDERACIÓN RUSA**

- Desmovilización inmediata y completa de todas las Fuerzas Armadas de Ucrania, incluidas, entre otras, las armas pesadas y otros equipos militares

- Alto el fuego inmediato y completo por parte de las Fuerzas Armadas de la Federación Rusa

- Retirada de las armas pesadas por parte de la Federación Rusa

- Vigilancia de la OSCE

- Reforma constitucional inmediata en Ucrania, incluida la descentralización, teniendo en cuenta la República Popular de Donetsk y la República Popular de Luhansk

- Retirada por parte de la Federación Rusa del resto del equipo militar, las formaciones armadas extranjeras y los mercenarios, sujeta a la reforma constitucional antes mencionada

- Todas las demás disposiciones de Minsk II

- Diplomacia inmediata para otras condiciones de paz pertinentes

- Fin inmediato de todas las medidas represivas contra los manifestantes contra la guerra

**EE.UU. y EUROPA**

- Ninguna participación directa de los miembros de la OTAN, incluidas las zonas de exclusión aérea

- Ningún apoyo a las personas que elijan luchar por el gobierno ucraniano

- Ningún envío de armas al gobierno ucraniano Gobierno

- Abolición de todas las sanciones contra el pueblo ruso, incluidos los sectores vitales de la economía rusa

- Denuncia inmediata de las prácticas chovinistas llevadas a cabo o toleradas por Ucrania

- Aceptación inmediata de los refugiados de guerra

- Satisfacción inmediata de todos los intereses de seguridad geográficos de la Federación Rusa, por parte de todas las potencias atlantistas (EE.UU. y Europa)

- Abolición de la OTAN, posterior a la satisfacción de los intereses de seguridad antes mencionados

**¡No se debe librar ninguna guerra, excepto la guerra de clases!**"
Liberal,Liberal,182,Mucha gente en Occidente (al menos en Estados Unidos) cree que Occidente es superior y debería liderar el mundo (tomar todas las decisiones) aunque no tengamos ni siquiera mil millones de habitantes en total. Muchos incluso afirman que Estados Unidos ha sido un gran líder. Occidente es casi totalmente blanco. ¿Se debe esto en parte a la superioridad blanca?
La raíz de la democracia.,Liberal,54,Liberal
¿Dónde están estas publicaciones y comentaristas pro-Putin?,Liberal,0,
"Según el subreddit “tankiejerk”, Amy Goodman y Jeremy Corbyn ahora son Tankies.",Liberal,708,
Podcast La caída de Roma: Presentamos Tides of History,Liberal,1,
El Consejo de Seguridad de la ONU aprueba una sesión especial de la Asamblea General sobre Ucrania,Liberal,32,
