Title,Political Lean,Score,Text
¿Por qué Polonia es tan derechista y qué pasó con el partido comunista allí?,Liberal,113,"He oído que Polonia fue uno de los primeros países en abandonar el comunismo y que la supuestamente comunista Polonia era una de las peores repúblicas socialistas, con el movimiento Solidaridad y todo eso. ¿Alguien puede decir qué fue lo que llevó a todo eso y por qué Polonia se ha convertido en uno de los estados más reaccionarios de Europa?"
¿Dónde puedo ver buenos vídeos sobre la situación de Ucrania?,Liberal,5,"Solía ​​ver a Hasan Piker, pero por lo que he leído, sus opiniones sobre la situación no eran las mejores. Todavía me gusta el tipo, pero mirar durante horas lo que sucede en Ucrania no es eficiente. ¿Alguien puede indicarme algunos videos o artículos donde pueda mantenerme al día sobre la situación en Ucrania y aprender sobre la historia del país con Rusia?"
La reacción de Trump ante Ucrania,Liberal,351,
"Después de cinco años, #MeToo finalmente ve acción en el Capitolio",Liberal,10,
“Tengo idiotas en mi equipo”: Romney critica a sus compañeros republicanos por asistir a un evento nacionalista blanco y apoyar a Putin,Liberal,67,
