Title,Political Lean,Score,Text
¿Puede obligarse al capitalismo australiano a abandonar el carbón?,Liberal,25,
De la revolución cautiva a la Gran Prisión de Gaza por Nahla Abdo,Liberal,4,
¿Reflexiones sobre Venezuela?,Liberal,1,Declaración fundacional del Sindicato de Trabajadores Metalúrgicos de Corea
Sanciones contra la liberación: una conversación sobre el Zimbabue de hoy,Liberal,6,
Cómo socialistas y sindicalistas construyeron un nuevo modelo de organización laboral durante la pandemia,Liberal,18,
Esto es lo que hacen los gigantes globales: autores desconsolados por el cierre de Westland por parte de Amazon,Liberal,5,
"Los votantes latinos podrían impulsar a los demócratas bajo el nuevo mapa de la Cámara de Representantes de California, si logran revertir los avances del Partido Republicano",Liberal,105,
"""No sirve de nada quejarse"": Obama pide a los demócratas que ""aprovechen las victorias que puedan conseguir""",Liberal,444,
38 podcasts que encontré - Lemmygrad,Liberal,1,
Liberal,Liberal,44,"Parece que los capitalistas están haciendo otro intento de hacer más vigilancia en Internet bajo el pretexto de proteger a los niños de la explotación sexual.

Sabemos que eso es mentira, pero parece un movimiento de poder desesperado para controlar lo que sucede en Internet con mano de hierro. En realidad, no les importan los niños. Necesitan pensar que eres lo suficientemente crédulo como para estar de acuerdo con lo que dicen que es correcto para ti, pero ¿quién les dijo lo que crees que es correcto o incorrecto?

Si se firma, las conversaciones y las imágenes no estarán encriptadas, lo que perjudicará a las comunidades marginadas y violará claramente la primera y la cuarta enmienda.

No me gusta este intento de revivir un proyecto de ley que no beneficia a nadie más que al gobierno plutocrático que quiere que se firme.

https://act.eff.org/action/stop-the-earn-it-act-to-save-our-privacy"
¿Hay alguna clase de la serie Grandes Cursos que recomendarías para socialistas/marxistas?,Liberal,10,"Siempre he sido un gran admirador de la biblioteca por razones obvias. Una vez que descubrí que tenían clases de Great Courses para tomar prestadas de forma gratuita, me emocioné muchísimo y planeé tomar un montón de clases. Sin embargo, aunque vi un par de cursos, mis opiniones políticas cambiaron de ""liberales"" a ""socialistas/marxistas"" y me preocupa mucho que la educación que proviene de Occidente no brinde una imagen completa de los acontecimientos. 

Aun así, siento que Great Courses puede tener algún valor y quería ver si otros socialistas/marxistas encontraron algún curso en particular útil para su educación de izquierda/en general."
¿Es necesaria la seguridad social? | Debate sobre Big Papa Fascist (Andrew Wilson),Liberal,10,
¿Qué opinas de Keir Starmer como líder del Partido Laborista?,Liberal,46,
La Liga Antidifamación no es lo que parece - Boston Review,Liberal,1,
La Liga Antidifamación no es lo que parece - Boston Review,Liberal,1,
Petición para evitar que Jeff Bezos destruya un puente histórico para que su barco pueda pasar por él,Liberal,1068,
"Las compañías de préstamos estudiantiles han gastado millones en luchar contra iniciativas como la promesa de Biden de cancelar la deuda por 10.000 dólares, y hasta ahora están ganando.",Liberal,40,
¿Consideras a Bernie Sanders un izquierdista?,Liberal,35,
¿Se puede ser terrateniente sin explotar a las personas o son por naturaleza lo mismo?,Liberal,2,"Lo siento si este no es el lugar adecuado para preguntar esto, pero tengo un dilema. 

Hace poco, me enteré de que un amigo de la familia me dejó su casa en su testamento. La casa está un poco apartada y me gusta donde vivo ahora. No me gustaría venderla, ya que podría querer vivir allí en el futuro, pero el hecho de ser propietario de una casa conlleva muchos gastos. La solución obvia sería alquilarla, pero bueno, todos conocemos los problemas que eso conlleva. 

¿Hay alguna manera de alquilar sin explotar a las personas o hacerlo me convertiría en un hipócrita?"
Canadá: Derrocan a líder conservador en medio de protestas de extrema derecha del “Convoy de la Libertad”,Liberal,49,
"Atrapada en la deuda con el FMI, Argentina recurre a Rusia y se suma a la Iniciativa del Cinturón y la Ruta de China",Liberal,33,
Lenin y el socialismo en un solo país - Workers Today,Liberal,2,
Por qué el socialismo necesita los suburbios,Liberal,4,
ACTÚA AHORA: ¡Starbucks está despidiendo a los trabajadores que quieren un sindicato!,Liberal,292,
"¿Qué estás leyendo? - Febrero, 2022",Liberal,14,"Saludos a todos, aquí está el hilo de WAYR de {{date %B, %Y}}.

Cuéntanos qué has estado leyendo durante el último mes. Libros o revistas, ficción o no ficción, socialistas o antisocialistas... ¡puede ser cualquier cosa! Da todos los detalles que quieras, ya sea una simple mención, una breve sinopsis o incluso una reseña. Cuando hagas una reseña, utiliza la escala de calificación oficial de /r/Socialism:

>★★★★★ - ¡Genial! 
> 
>★★★★☆ - ¡Bastante bueno! 
> 
>★★★☆☆ - Aceptable 
> 
>★★☆☆☆ - Bastante malo 
> 
>★☆☆☆☆ - Ayn Rand

Como recordatorio, nuestra barra lateral y wiki contienen muchas listas de lectura que pueden resultar útiles:

* [Paquete de inicio sobre el socialismo](https://www.reddit.com/r/socialism/wiki/index/starterpack)
* [Acontecimientos históricos](https://www.reddit.com/r/socialism/wiki/index/historicalevents)
* [Biografías](https://www.reddit.com/r/socialism/wiki/index/biographies)
* [Lecturas sugeridas](https://www.reddit.com/r/socialism/wiki/suggested_readings)
* Socialistas negros de Estados Unidos Guía de recursos de la BSA (https://blacksocialists.us/resource-guide)"
"Estimado HSBC, usted afirma que no puedo pagar una hipoteca, pero yo pago la de mi casero. Tengo curiosidad.",Liberal,673,
"Es casi como si realmente no les importara ""lo nuestro"".",Liberal,20,
La huelga general de Oakland de 1946,Liberal,12,
¿Ya casi estás? ¿Ya casi?,Liberal,2626,
Sociedades de mercado versus sociedades con mercados,Liberal,11,
Los condados de Texas rechazan una cantidad sin precedentes de votos por correo antes de las primarias del 1 de marzo según una nueva ley restrictiva,Liberal,51,
"Los investigadores dicen que tenemos una ""epidemia de narcisismo"". ¿Qué la causa? - Big Think",Liberal,147,
Una colección de citas para recordar el verdadero propósito de las guerras.,Liberal,1681,
Las plataformas de Internet que todos utilizamos deberían ser de propiedad pública y controladas democráticamente,Liberal,76,
¿Por qué hay tan pocos socialistas?,Liberal,27,"Durante el último año y medio o dos años, poco a poco he ido aprendiendo más y más sobre política. Me he radicalizado bastante hacia la izquierda, empezando como un individuo mucho más liberal e incluso centrista. Pero ahora me considero extremadamente socialista y progresista, especialmente en comparación con antes. Pero siendo como soy ahora, casi parece que siempre he sido así, si eso tiene sentido. Ya que ahora es bastante integral a mi identidad. No obstante, pensando en ello con bastante frecuencia, no entiendo cómo más gente no puede hacer lo mismo. Siempre estamos en nuestros teléfonos, casi la mitad del día para la mayoría de las personas. Pero todavía tenemos tanta gente que es bastante ignorante (intencionadamente o no) sobre todo lo que sucede en el mundo. Mantengo mis creencias muy cerca de mí, y muy firmemente. Pero me parece muy extraño cuando la gente dice que ""no le importa la política"". Como si, de una forma u otra, siempre te fueran a afectar. especialmente considerando que muchos temas que se han vuelto más políticos (ya sea justificados o no), tienen que ver con ciertos grupos marginados de personas que literalmente tienen derechos en este mundo olvidado por Dios; LGBTQIA+, mujeres, minorías, etc. Siempre hablo de política de alguna manera con la gente y siempre trato de ayudar a educar a quienes me rodean, porque es algo que me apasiona muchísimo y quiero seguir investigando. Simplemente me frustra que no haya más personas que estén en el mismo lugar que yo. No es que sea la única persona así, por supuesto. Creo que ahora más que nunca la gente está empezando a prestar atención a los problemas modernos; el capitalismo en general, la desigualdad de la riqueza, el racismo, los derechos y la concienciación de las personas LGBTQIA+, etc., pero siempre parece que demasiadas personas simplemente se quedan al margen y observan cómo el mundo se quema cada vez más, simplemente siendo más insensibles a todo ello. Y realmente me frustra y me pone muy triste porque está sucediendo a nuestro alrededor y nos afecta a todos. Estoy seguro de que la gente puede ver lo que quiero decir con todo esto. Pero la moraleja de la historia es que hay que educarse, aunque sea un poco. No es tan difícil como uno piensa.

-
TLDR: ¿POR QUÉ NO PUEDE HABER MÁS PERSONAS QUE REALMENTE SE PREOCUPEN POR EL MUNDO, POR CÓMO NOS AFECTA A NOSOTROS Y A LAS PERSONAS QUE MÁS LO NECESITAN? No debería ser tan difícil."
"¡Contra las teorías conspirativas, por una respuesta de la clase trabajadora a la pandemia!",Liberal,1,
Murray Bookchin: El trabajo como juego,Liberal,5,
Somos el 99%,Liberal,11,
Experiencia: Tomé bloqueadores hormonales para convertirme en campeona de patinaje sobre hielo | Vida y estilo,Liberal,18,
Cómo mentir con las estadísticas de desigualdad,Liberal,5,
Cómo Manchin utilizó la política para proteger la empresa de carbón de su familia,Liberal,57,
La Universidad de Alabama eliminará el nombre del líder del Ku Klux Klan del edificio,Liberal,165,
"El terrible destino que afronta el pueblo afgano: A pesar de las reiteradas advertencias de los organismos de la ONU sobre el inminente desastre humanitario que se está produciendo en Afganistán, el gobierno de Estados Unidos y otros han decidido negar al gobierno fondos para salvar vidas.",Liberal,16,
"La CIA, Kwame Nkrumah y la destrucción de Ghana",Liberal,16,
"Clinton reprende a Trump por acusaciones de que arrojó documentos al inodoro de la Casa Blanca: ""Pero sus correos electrónicos...""",Liberal,3,
"Iniciado por George Washington, firmado en 1796 por John Adams y ratificado por unanimidad por un Senado repleto de firmantes de la Constitución, el Tratado de Trípoli declaraba al mundo: ""el Gobierno de los Estados Unidos de América no está, en ningún sentido, fundado en la religión cristiana"".",Liberal,3,"Sé que es una frase reciente, pero ¿alguien conoce algún buen libro que demuestre que la policía NO está de nuestro lado? He escuchado argumentos, pero nunca me han parecido muy sensatos. ¿Algún buen libro? Gracias."
Biden firma una orden para confiscar 7.000 millones de dólares en activos del banco central afgano - ASQUEROSO,Liberal,60,
"Entrevista a Kshama Sawant: Los demócratas recortaron vergonzosamente los pagos por riesgo, cavando más profundo que el ingreso demócrata frente a la salida demócrata",Liberal,3,
"Entrevista a Kshama Sawant: Los demócratas recortaron vergonzosamente los pagos por riesgo, cavando más profundo que el ingreso demócrata frente a la salida demócrata",Liberal,11,
Artículos sobre Ucrania y Rusia,Liberal,14,"Hola. 
He perdido la cuenta de la cantidad de opiniones liberales imperialistas sobre los derechos humanos y el cerebro muerto sobre Rusia y Ucrania. ¿Hay algún buen texto (los podcasts también cuentan) que te parezca justo y que invite a la reflexión? 

Gracias."
Ya no se puede ignorar más,Liberal,2559,
Comidas gratuitas universales para estudiantes,Liberal,29,
San José protesta contra la guerra de Estados Unidos contra Rusia,Liberal,2,
Liberal,Liberal,6,
¿Historias de éxito?,Liberal,5,"Estoy considerando seriamente unirme a su partido, pero ¿qué éxito electoral o legislativo ha tenido?

Supongo que el propio Bernie y el movimiento de los demócratas hacia la izquierda. Aparte de eso, ¿no?"
En cuanto a las protestas...,Liberal,2960,
"PBS: Putin invadirá Ucrania la próxima semana, según funcionarios estadounidenses",Liberal,125,
La DSA de Atlanta expulsa a aproximadamente 1/3 de sus miembros activos (enlaces a documentos y capturas de pantalla en el hilo de Twitter),Liberal,3,
¿Cuál es el mejor libro para aprender sobre la revolución rusa y más allá?,Liberal,6,
"El impacto de Chato Peredo, “el último soldado del Che”, en el partido MAS de Bolivia",Liberal,10,
¿Cómo podemos reducir el tiempo necesario para lograr una atención sanitaria universal?,Liberal,11,Una crítica que escucho sobre la atención médica universal es que es demasiado lenta en los países en los que se ha probado. ¿Cómo abordarías entonces la posibilidad de acelerar el proceso?
Biden se reúne con aliados mientras continúan las tensiones con Rusia por Ucrania,Liberal,28,
Nuevo informe detalla la influencia del nacionalismo cristiano en la insurrección,Liberal,144,
Una unidad de policía táctica lanza gases lacrimógenos contra activistas y refugiados que viven en un bloque de pisos vacío en Calais,Liberal,3,
"Willy Brandt y los fundamentos de la UE: el pragmatismo excesivo se convierte en un vicio en sí mismo, en una falta de voluntad para tomar decisiones difíciles",Liberal,20,"Algunos de los problemas actuales de la UE se remontan a algunas decisiones muy malas tomadas durante la década de 1970, y la actitud de Willy Brandt es un buen ejemplo del problema: 

""*Pero después de los entusiasmos de su juventud, ya no se sentía atraído por las grandes y complejas estructuras o la creación de un estado supranacional; en otras palabras, como le explicó a Pompidou: 'ni por el perfeccionismo institucional, ni por las abstracciones integracionistas'. Lo que se necesitaba era pragmatismo y la provisión de las herramientas necesarias para que la alianza de estados europeos funcionara"".*

Rechazó el fascismo y el comunismo y los experimentos que habían proliferado durante su juventud; eso parece algo positivo. Pero aquí llegó al extremo de evitar pensar seriamente sobre qué instituciones deberían existir para que la UE fuera completamente funcional y saludable. 

Ya he mencionado antes que estoy volcando mis notas de investigación en mi Substack. Hoy escribo un poco sobre cómo esta evasión de la ""perfección institucional"" se transformó en una falta de voluntad para pensar seriamente sobre qué instituciones eran necesarias para garantizar el éxito de la democracia a nivel paneuropeo:

[https://demodexio.substack.com/p/willy-brandt-the-life-of-a-statesman-d73](https://demodexio.substack.com/p/willy-brandt-the-life-of-a-statesman-d73)"
"Sí, yo tampoco lo sé, joder.",Liberal,71,
A veces incluso los titulares necesitan una corrección de hechos,Liberal,41,
"Obama pide a los demócratas que se concentren en sus ""victorias"" durante la campaña de mitad de mandato",Liberal,494,
Camaradas de Boston: ¡¡Mañana todos marcharemos a la sede del BPD para exigir justicia!!,Liberal,10,
Dúo de música cubana Buena Fe pospone concierto en Canadá en defensa de las vacunas cubanas,"Es como si los republicanos estuvieran tan desesperados por enjuiciar a Biden que se olvidaron de que Nixon, Clinton y sí, Trump fueron enjuiciados por cosas que no estaban relacionadas con sus deberes como presidentes... Tener una mala estrategia no es motivo de enjuiciamiento. Si lo fuera, ningún presidente pasaría jamás de los dos años.",15,
"DECLARACIÓN: Protesta del Caucus Negro en la Asociación de Estudios Africanos, Montreal, octubre de 1969",Liberal,7,
Socialistas judíos,Liberal,66,"Tengo curiosidad por ver si hay muchos judíos en este subreddit. Creo que el judaísmo y las ideologías de izquierda en general tienen mucho en común. Me crié en una comunidad judía y asistí a la escuela hebrea, sin embargo, en la mitad de mi adolescencia comencé a rechazar mi religión y también comencé a adentrarme más en el izquierdismo. Varios años después, ahora he recuperado mi fe y en mis estudios me he dado cuenta de cuánto tienen en común mis creencias espirituales/religiosas redescubiertas con las creencias políticas que he desarrollado. Me encantaría saber si alguien ha tenido una experiencia similar o incluso opuesta. También Shabat shalom para todos, espero que tengan un día bendecido."
NicaNotes: 2021: Un año de grandes avances en Nicaragua - Alianza por la Justicia Global,Liberal,7,
Vídeo sobre la situación actual del Partido Comunista en la República Checa y los acontecimientos que llevaron a su creación,Liberal,8,
"¿Alguien puede ayudar con un resumen del conflicto entre Rusia, Ucrania y la OTAN, por favor? Se lo agradezco. Además, sigo viendo que la gente dice que Ucrania está infestada de nazis. ¿Alguien puede explicarlo con más detalle?",Liberal,5,
"Joe Walsh sobre lo que la izquierda no entiende: TrumpWorld ""quemaría felizmente este país""",Liberal,346,
"¡Empleo, justicia y un mundo habitable!",Liberal,2,
"El colonialismo nunca terminó | Neocolonialismo, semicolonias y capitalismo burocrático",Liberal,31,
Por qué millones de estadounidenses están renunciando a sus trabajos,Liberal,28,
Analizar la situación de Ucrania sin belicismo corporativo,Liberal,2,
Acabo de enterarme de que nuestro Departamento de Policía local está recibiendo la revista The New American,Liberal,3,"Vivo en un estado profundamente republicano de los EE. UU., pero me preocupa descubrir que nuestros policías locales están recibiendo esta [mierda de la extrema derecha](https://en.wikipedia.org/wiki/The_New_American). Quiero decir, la policía estadounidense y el fascismo tienden a ir de la mano, pero ¡qué carajo! 

Una carta al editor en la primera página afirma que los demócratas estadounidenses están utilizando de alguna manera la inmigración ilegal para instituir el ""socialismo totalitario"", el fascismo (¿eh?) o incluso tal vez el comunismo (aparentemente el siguiente paso después del fascismo 🤨). Esos demócratas astutos. Saltando por todo el espectro político 😂

De todos modos, en un solo número lograron de alguna manera impulsar tanto el belicismo internacional como el aislacionismo, cubrir una extensa apología de Qanon mientras intentaban parecer analíticos, apelar al culto a Trump, defender la posesión de armas solo para blancos, ofuscar las causas de los problemas económicos actuales, promover el imperialismo estadounidense y el elitismo corporativo, ponerse en marcha con Brandon, impulsar la negación climática, arrojar basura anti-vacunas y pro-ivermectina (pero la pandemia también es un engaño), e inflar aún más el fantasma de la ""izquierda radical"".

Tal vez esta sea solo mi humilde opinión, pero las publicaciones creadas por personas como [la John Birch Society](https://en.wikipedia.org/wiki/John_Birch_Society#cite_note-Bernstein_Jordan_Brinkley-7) no deberían estar a menos de 10 millas de un departamento de policía financiado con impuestos. Al parecer, estar en desacuerdo con el fascismo me convierte en fascista, así que me quedaré en casa tiñendo [Mis fundas de almohada](https://www.mypillow.com/luxury-pillowcases-set-of-2) de negro y cosiéndolas para hacer camisas, supongo."
#JusticeForAmirLocke: Un hombre negro de 22 años de Minnesota fue asesinado por la policía en una redada sin previo aviso. Imágenes de protestas masivas.,Liberal,10,
"El FBI intentó convencer a un musulmán deprimido de que cometiera un ataque terrorista y, después de descubrir que no lo haría, lo arrestaron de todos modos.",Liberal,17,
¡Recibí una sorpresa muy genial en el correo de mi hermano! Estoy súper emocionado de leerlos todos.,Liberal,20,
¿Cómo trabajan los anarcocomunistas?,Liberal,6,"Soy marxista, pero quiero entender el anarquismo más de lo que lo hago ahora porque creo que es importante, pero no entiendo cómo alguien puede ser anarcocomunista, porque ¿no es el comunismo una ideología anarquista de todos modos? ¿Es porque quieren diferenciarse de los anarcocapitalistas y simplemente decidieron poner ""comunista"" en su nombre o hay una razón más profunda para ello? 

Editar: Bueno, creo que la pregunta ya ha sido respondida."
Prioridades socialistas en su país,Liberal,6,"Si el socialismo llegara al poder en su país, ¿cuáles serían sus cinco prioridades? ¿Por qué?"
Socialismo y libertad liberal,Liberal,3,"¿Cuál cree usted que debería ser la relación entre el gobierno socialista y las libertades individuales? En particular, los valores liberales, como el actual sistema educativo, o los principios conservadores, como la familia nuclear. 

Entiendo que la libertad y la familia no son propiedad de una ideología, pero creo que estos ejemplos son árbitros políticos e históricos de la gente que decide contra el socialismo. 

¿Hasta qué punto puede actuar el socialismo para preservar esas instituciones que tienen un valor tradicional y personal?"
¿Qué significa “proletarizarse”?,Liberal,9,Liberal
"El convoy de camioneros canadienses es un levantamiento impopular, un movimiento marginal que protesta por su derrota.","George W. Bush maximiza las donaciones políticas a las partidarias del impeachment de Trump, Liz Cheney y Lisa Murkowski",108,
Trabajador de McDonalds,Liberal,30,
"Si alguien quisiera unirse a un partido socialista/comunista en los Estados Unidos, ¿cuál me sugerirían?",Liberal,6,"DSA no es un partido político y, además, es un grupo muy amplio, con miembros que van desde liberales progresistas hasta comunistas, así que no cuentan. Cualquier otra sugerencia es bienvenida."
Richard Wolff habla sobre la sindicalización en Estados Unidos en la reciente actualización económica,Liberal,5,
¡Te lo dije hermano!,Liberal,1402,
Biden dividirá 7.000 millones de dólares en fondos congelados entre las víctimas del 11 de septiembre y la ayuda humanitaria afgana,Liberal,430,
Salario versus sueldo,Liberal,22,"Mi directora sugirió que mi equipo de terapeutas considere cambiar a un salario en lugar de un sueldo fijo. Tengo mucha influencia en lo que sucederá. 
Ella dice que nos permitirá ser más flexibles con nuestros horarios e irnos cuando terminemos nuestro trabajo. Una de mis colegas socialistas dijo específicamente que le encantaría ser asalariada. 
Me preocupa que esto cambie lentamente las expectativas de productividad y que mis terapeutas ligeramente codependientes se equivoquen por el lado de ser sobreprotectores. 

¿Pueden ayudarme a pensar en esto? ¿Han investigado algo al respecto?"
¡Estamos creando un nuevo movimiento obrero para una nueva generación! Despierta y huele el cambio.,Liberal,1286,
Únase a un sindicato.,Liberal,12,
Starbucks ha desmantelado sindicatos desde 1987: ¿cómo podemos ganar esta vez?,Liberal,21,
"¡Contra las teorías de la conspiración, por una respuesta de la clase trabajadora a la pandemia! - Organización de Trabajadores Comunistas",Liberal,13,
China reivindica la detención de dos traficantes de personas en el caso de la mujer encadenada,Liberal,24,
