,text,cmp_code
1642,Fear of crime affects the quality of life and the free development of the personality.,605
1643,"With a present police force and clever urban planning measures, we want to increase people's sense of security.",605
1644,Local safety partnerships also serve this purpose.,605
1645,We reject vigilante groups.,201
1646,We consistently combat vandalism.,605
1647,"Video surveillance of public crime hotspots is a police tactical tool, but it does not replace policing.",605
1648,- Security as a public good.,605
1649,Safety must not become a commodity.,605
1650,It is the responsibility of the state to ensure the safety of its citizens.,605
1651,"We need good equipment in schools, police, justice and youth welfare.",605
1652,We reject the privatization of state security tasks. -,605
1653,"Consistently against crime and violence,",605
1654,but also tough on their causes.,503
1655,"Unequal life chances, lack of prospects, lack of education, social disadvantage are causes of crime.",503
1656,Young people from immigrant families are often particularly affected by this.,705
1657,A good education,506
1658,and integration policy is therefore also a security policy.,607
1659,We outlaw all forms of violence,605
1660,and focus on preventive measures against youth violence.,503
1661,This includes the increased use of street workers and school social workers.,503
1662,We will continue to develop the national action plan to combat violence against women.,605
1663,- Making access to weapons more difficult.,605
1664,We have continuously tightened gun laws since 2002.,605
1665,"Today, Germany has one of the most restrictive gun laws in the world.",605
1666,But it has become painfully clear that unauthorized persons still obtain weapons too easily.,605
1667,We want to see fewer weapons in private hands and make access to them much more difficult.,605
1668,"We will tighten controls on sport shooters and hunters who store weapons privately, increase the requirements for private storage and give the regulatory authorities more opportunities to monitor compliance with these regulations.",604
1669,- Combating drug-related crime.,605
1670,We pursue a three-part approach to drug-related crime:,605
1671,preventive toward potential users,705
1672,- repressive toward suppliers -,605
1673,therapeutic toward addicts.,705
1674,- Punish juvenile delinquency quickly.,605
1675,"If juveniles commit a crime, the sanction must follow ""on the heels"" of the crime.",605
1676,Juvenile criminal proceedings must be opened quickly and any sentence imposed must be enforced promptly.,605
1677,Only then will the juveniles understand the connection between the crime and the punishment and can the educational effect of juvenile criminal law become effective.,605
1678,We reject mere incarceration on the basis of adult criminal law.,605
1679,- Victim protection.,705
1680,We have continuously improved the position of crime victims in criminal proceedings.,705
1681,They now have more rights of their own in the process and are better protected as witnesses.,705
1682,- Brand violence in families.,605
1683,"Domestic violence is neither a taboo subject nor a ""private matter"", but a criminal wrong.",605
1684,We therefore want to see consistent implementation of the Protection Against Violence Act.,605
1685,We will continue to develop the national action plan to combat violence against women.,706
1686,- Protect children.,706
1687,We are fighting sexual violence against children and child pornography with the help of criminal law and also on the Internet.,605
1688,"If necessary, children must also be protected from their parents.",706
1689,"Family courts have been given more legal options to intervene more quickly, effectively, and sustainably when children are at risk.",605
1690,Now it's a matter of putting these improvements into practice.,605
1691,Combating white-collar and organized crime,NA
1692,- Equal rights for all.,605
1693,Our laws must be followed and enforced in all parts of society.,605
1694,White-collar crime and tax evasion are not trivial offenses.,605
1695,That is why we have significantly increased the maximum limits for fines.,605
1696,"We need specialized prosecutor's offices and better staffing and equipment for the judiciary to create ""equality of arms"" with the accused and their top defenders.",605
1697,The civil liability of managers vis-à-vis their companies must be more consistently enforced and tightened.,605
1698,- Combating corruption.,605
1699,We are creating a registry for corruption cases and other manifestations of white-collar crime.,605
1700,This is intended to exclude conspicuous companies or persons from the award of public contracts.,605
1701,We also contribute to the fight against corruption with modern disciplinary and secondary employment law.,304
1702,- Prosecution of organized crime.,605
1703,"We consistently pursue organized crime such as racketeering, drug and human trafficking, and product and brand piracy.",605
1704,Fighting terrorism Protecting civil rights,NA
1705,- Effective Counterterrorism.,605
1706,The SPD has continuously improved the conditions for effective counterterrorism in all areas of government:,605
1707,the security authorities have been given the necessary legal powers.,605
1708,We have better staffed them and ensured that they remain technically up to date.,605
1709,"We have also improved coordination among authorities nationally, Europe-wide and internationally.",303
1710,- Protecting citizens' rights.,201
1711,"To protect citizens' civil liberties, we have clearly limited the powers of the security authorities and made them subject to strict conditions.",201
1712,We will regularly review our laws involving encroachments on fundamental rights in the fight against international terrorism for proportionality and necessity.,201
1713,- Clear distinction between internal and external security.,201
1714,We maintain the clear separation of police and intelligence services in line with the separation requirement.,201
1715,We reject the use of the Bundeswehr in internal security operations.,201
1716,Justice needs a strong judiciary,NA
1717,- Efficient judiciary.,605
1718,"We need a strong judiciary to fight crime,",605
1719,protect civil rights,201
1720,", and enforce justice in all segments of society.",503
1721,"Sufficient personnel, responsible salaries and modern equipment ensure the efficiency of the judiciary.",605
1722,- Those who are right must also receive justice.,503
1723,Access to justice must not depend on one's wallet.,503
1724,This is a requirement of the social constitutional state.,503
1725,We therefore advocate the preservation of legal aid and counseling assistance.,503
1726,- No privatization of the judiciary.,605
1727,"With us, there will be no selling off of sovereign tasks.",605
1728,There are many things that the state can do better and more cheaply than the private sector.,413
1729,"We therefore reject privatization of, for example, the penal system, land registry offices, bailiff services and commercial registers.",413
1730,Data protection in government and business,NA
1731,- Data protection secures personal freedom and self-determination.,201
1732,"We do not want a transparent citizen, which is why the prerequisites for government data collection and the uses of the data must be clearly regulated by law and strictly limited.",201
1733,We reject a preventive state that also collects and monitors the data of bystanders in its search for sources of danger.,201
1734,- Improve consumer data protection.,201
1735,Companies are collecting more and more personal data from their customers and employees.,201
1736,They increasingly endanger the right of citizens to decide for themselves who knows what about them.,201
1737,We have tightened the legal regulations on the transfer of customer data,201
1738,and will ensure strict compliance with these provisions.,605
1739,- Regulating employee data protection by law.,201
1740,No employee should be spied on and spied on by his or her employer.,201
1741,The data scandals in many companies have shown that we need a special employee data protection law.,201
1742,11. a responsible approach to the environment and nature,NA
1743,Our natural resources are a public good that must be protected from overuse.,501
1744,"Nature conservation in Germany, in Europe and in the world must continue to be significantly strengthened in the coming years.",501
1745,This is an ethical responsibility.,501
1746,"However, it is not only nature that will benefit, but also the economy:",408
1747,the protection and sustainable use of biodiversity generates major economic and business benefits.,501
1748,Nature conservation and environmental protection are also preventive health policies.,501
1749,Socially weaker population groups are more affected by noise and air pollution than others.,503
1750,It is therefore also an imperative of social justice to ensure improvements here.,503
1751,"More environmental protection also benefits employees at their workplace because they benefit in terms of health from environmentally friendly, innovative production processes or improved technologies.",701
1752,Consumers have a key role to play here:,403
1753,Responsible and informed consumers play a growing role in the social market economy and civil society based on solidarity.,403
1754,What we want: Environment and nature conservation,NA
1755,- Efficient use of resources.,501
1756,We will take further measures to increase the efficient use of materials on the one hand,501
1757,and reuse and recycling on the other.,501
1758,We will also base the promotion of new products on their recyclability and the willingness of producers to recycle.,501
1759,"In doing so, we rely not only on regulatory measures but also on voluntary commitments.",401
1760,"By 2020, we will double resource efficiency compared to 1990.",501
1761,- Environmental Code.,501
1762,"The implementation of an environmental code and a forest law that guarantees the sustainable protection of our forests, which was not possible with the CDU/CSU in the federal government, will be launched by an SPD-led federal government in the first few months.",501
1763,- Strengthening nature conservation.,501
1764,The SPD has strengthened nature conservation in Germany with the national natural heritage program and the national biodiversity strategy.,501
1765,Nature conservation means the preservation of our homeland.,501
1766,Biodiversity is also an important and often underestimated economic factor.,501
1767,We will continue along this path with new instruments.,501
1768,- Nature conservation investment offensive.,501
1769,We will launch a nature conservation investment offensive.,501
1770,"This includes a National Program for Floodplains, Peatlands, and Other Wetlands and Natural Forests.",501
1771,We want to realize an International Forest Conservation Fund to be able to ensure the protection of forests and other carbon storing ecosystems.,501
1772,We will launch a federal avenue program and a green bridge program with which we will preserve avenues and use green bridges to reduce the existing fragmentation of the landscape.,501
1773,"For international forest protection, we will ensure that the import of illegally logged timber and products made from it into the EU is finally effectively curbed.",501
1774,- Marine protection.,501
1775,"We will advance the creation of a global, representative network of marine protected areas by 2012 and create the first marine national park where nature conservation takes priority over all uses.",501
1776,- Restrict land use.,501
1777,We will put a stop to the unacceptable land consumption of over 100 ha/day.,501
1778,We want to test the concept of land certificates in a major pilot project:,303
1779,"After agreeing on upper limits for future annual settlement expansions, municipalities will receive land certificates that they can trade among themselves.",303
1780,Environmental protection is health protection,NA
1781,- Avoid environmentally harmful products.,501
1782,We need clear rules to prevent damage to health from products of concern.,403
1783,"To this end, we will tighten limit values.",403
1784,- Reducing pollutant emissions.,501
1785,"To reduce particulate matter pollution, we will lower the emission limits for nitrogen oxides and dust in industry and commerce.",501
1786,We will tighten the limits for dust for all small combustion plants using solid fuels.,501
1787,- Reduce emissions and noise from traffic.,501
1788,We will expand incentives for low-emission vehicles.,501
1789,"In addition, we will further expand the federal government's noise abatement program for roads and rail lines and provide those affected by aircraft noise with soundproofing for their buildings.",411
1790,"In the European Union, we will work to significantly tighten noise regulations for equipment, machinery, motorcycles, cars, ships and aircraft.",501
1791,Opportunity for rural areas,NA
1792,- Innovation Offensive Rural Areas.,408
1793,Rural areas have long been undergoing a transformation process away from pure agricultural production toward multifunctional development.,408
1794,Ecological industrial policy finds its counterpart in sustainable regional development in rural areas.,408
1795,"We will launch an ""innovation offensive for rural areas"" to exploit the potential of rural areas as Germany's future regions.",408
1796,"In addition to the citizens who live and work in these regions, these areas are particularly characterized by their natural capital.",501
1797,"In order for this capital to bear fruit sustainably for future generations, innovative concepts for nature-compatible rural development must be implemented.",501
1798,"In addition to the environmentally compatible production of healthy, high-quality food,",703
1799,"tourism, nature conservation and landscape management, health care, renewable energies and the development of regional brands are crucial areas of dynamic rural development.",408
1800,"We want to create the conditions for more opportunities for participation and employment, especially in structurally weak rural regions.",408
1801,- New direction in agricultural policy.,703
1802,Our agriculture not only provides work and the production of important agricultural products.,703
1803,"It preserves cultural landscapes, protects our natural livelihoods and contributes to the sustainable development of rural areas.",703
1804,We have made a paradigm shift in agricultural policy.,703
1805,The interests of individual sectors of the agriculture and food industry should no longer take precedence over the objectives of consumer protection.,403
1806,and environmental protection dominate.,501
1807,"In the EU, we want to move away from a policy of watering-can subsidies for agricultural production and",703
1808,redirect these funds to supporting the development of rural regions,408
1809,"and providing socially desirable services such as water protection, keeping cultural landscapes open and safeguarding recreational areas.",501
1810,We are in favor of clear guard rails for sustainable production that protects nature and the environment.,501
1811,"We want to preserve biodiversity, protect soils and water.",501
1812,Agriculture must contribute more to climate protection; we want to support it in this.,703
1813,Improve animal welfare,NA
1814,- Reform Animal Welfare Act.,501
1815,Animal welfare is an important concern for us.,501
1816,We appreciate the high level of commitment of many citizens to animal welfare organizations.,606
1817,The SPD has succeeded in anchoring animal protection in the Basic Law.,501
1818,We are seeking an amendment to the Animal Welfare Act.,501
1819,We want a reduction in animal testing.,501
1820,We want to make the conditions under which farm animals are kept and transported more animal-friendly.,501
1821,- Animal welfare seal.,501
1822,"The so-called ""animal welfare TÜV"", pushed through by the SPD, forms the basis for the introduction of animal welfare seals.",501
1823,"If necessary, we will also introduce these as a pioneer at national level if no Europe-wide regulation is possible in the short term.",501
1824,Consumers can then directly influence more animal welfare when shopping.,403
1825,12. culture and media,NA
1826,Culture is the elementary basis of our democratic society.,502
1827,Political tasks for the future cannot be solved without the contribution of culture.,502
1828,Cultural dialogue is also the basis of international understanding and economic exchange.,502
1829,"The SPD will continue to seek dialogue with and advice from artists,",502
1830,"strengthen the freedom of the arts,",502
1831,and place a high value on social responsibility toward those who create culture.,502
1832,Our open concept of culture is not limited to the arts and their promotion.,502
1833,We Social Democrats advocate a culture of democracy in which art and culture are of central importance for social understanding about values and goals in a world of accelerated upheaval.,202
1834,"Because art and culture, as the intellectual foundations of life, shape people and strengthen social cohesion.",606
1835,"They hold up a mirror to a society, reflect lifestyles, formulate offers of identity and provide orientation.",502
1836,A culture of democracy and in democracy must therefore always also be a culture of cultural participation.,503
1837,What we want:,NA
1838,- Culture as a state goal.,502
1839,"As an overall state, Germany is obliged to protect and promote culture.",502
1840,That is why we will anchor culture as a state objective in the Basic Law.,502
1841,"The constitution expresses the order of values and meaning of our society, and culture is part of it.",502
1842,"For us, culture is the spiritual basis of life and a public good.",502
1843,"Promoting culture is not a subsidy, but an investment in the future.",502
1844,- Culture for all.,503
1845,"Everyone should have access to culture, because cultural and media divisions lead to social divisions.",503
1846,"Culture and education enable participation, self-realization and personal development.",502
1847,"Especially in our immigration society, they are at the same time an important element of integration and community.",502
1848,We will launch a broad-based initiative for arts education from early childhood education onward.,502
1849,"Public libraries, music and youth art schools, but also museums, theaters and cinemas must be used and promoted more as places of cultural education.",502
1850,The funding of public cultural institutions should be linked to cultural education programs.,502
1851,- Expansion of cultural infrastructure.,502
1852,A comprehensive cultural infrastructure is essential for a vital and developing cultural and creative industry.,502
1853,We want the state to pursue an activating cultural policy that provides targeted support for cultural infrastructure,502
1854,"and sees the promotion of culture as a mandatory task of the state, in joint responsibility with civil society and the market.",502
1855,- Promotion of the cultural and creative industries.,502
1856,Knowledge and ideas are the most important raw materials of our country.,502
1857,That is why we want to promote the cultural and creative industries to a special degree.,502
1858,"We propose a creative pact between politics, business, artists and creative people in which economic issues, social security issues, education and participation are discussed together.",502
1859,- Safeguarding cultural and media professionals.,502
1860,Social security for cultural and media workers is a central component of our creative pact.,502
1861,We will maintain and further strengthen the artists' social insurance (KSV) as a unique model worldwide.,502
1862,"We are committed to collective agreements and minimum social standards in the culture and media sector as well, and will tie federal funding to compliance with these minimum standards.",502
1863,- Fair remuneration for creative work.,503
1864,"Within the framework of the Social Democratic Creative Pact, we want to ensure that cultural and media professionals, artists and creative people can make a living from their work.",502
1865,It is important to protect intellectual property and to remunerate it appropriately.,502
1866,Copyright law and copyright contract law are intended to enable an appropriate income from the exploitation of intellectual property in the digital world.,502
1867,The future of digitalization presents us with new challenges in the protection of intangible products and goods.,403
1868,We need a reasonable balance between user-friendliness and the rights of creators.,403
1869,"In this context, we will involve network operators and Internet service providers in the dialog with rights holders and collecting societies as part of the creative pact.",403
1870,We are committed to testing a cultural flat rate.,502
1871,- Film as an important cultural asset.,502
1872,"With the Creative Pact, we want to further improve the framework conditions for film and strengthen film funding.",502
1873,Cinemas are important places of cultural and social coexistence.,502
1874,That's why we want to support the digitization of our cinema landscape.,502
1875,We will further develop the Film Subsidies Act into a Media Subsidies Act to meet the challenges of a digital media world.,502
1876,- Strengthen public broadcasting Maintain the dual broadcasting system.,502
1877,We rely on both pillars of our dual broadcasting system.,502
1878,"The cultural, educational and informational mandate of public broadcasting, which is enshrined in the German Basic Law, follows criteria other than maximizing audience ratings.",502
1879,We are committed to preserving this special role of public broadcasting.,502
1880,New media must always be part of the public broadcaster's offering.,502
1881,"At the same time, we are focusing on the further development of citizen media as part of democratic participation",202
1882,and as the third pillar of a future media order.,502
1883,- A modern media order in the digital age.,502
1884,An independent and diverse media system is indispensable for our democracy.,502
1885,Freedom of information and diversity of opinion are prerequisites for a social and democratic society.,201
1886,"This includes access for all people to all means of transmission, forms of communication, knowledge and information.",503
1887,We want to overcome the digital divide in Germany.,503
1888,That is why the expansion of the broadband network is a key task for us.,411
1889,We want to develop a media order that meets the requirements of the digital world.,502
1890,We want to preserve the diversity of the media,502
1891,and prevent monopolies and the development of concentrations.,403
1892,We therefore consider the establishment of a state media authority to be an essential instrument.,502
1893,- Informational self-determination.,201
1894,The protection of personal data,201
1895,and the fundamental right to informational self-determination are becoming even more important in the digital world.,201
1896,Data protection must be further developed.,201
1897,We also want individuals to be able to move safely in the digital world and learn what the consequences of voluntarily disclosing personal data can be.,201
1898,- Media license for children and young people.,506
1899,"Media competence is not only the key qualification in the information and communication society, but also an educational topic to be promoted.",506
1900,We will establish a media literacy foundation and introduce the offer of a media guide for all children and young people.,506
1901,13. dare more democracy,NA
1902,Democracy is rule by the people.,202
1903,"In other words, it is the citizens who freely and self-determinedly set rules for their coexistence.",202
1904,We in Germany know that this is a great achievement of civilization that we must defend against all threats.,202
1905,"Our democracy is threatened from various sides, not least by the dominance of the markets and the indifference of the people.",202
1906,"Willy Brandt called for ""more democracy"" 40 years ago.",202
1907,The Basic Law came into force 60 years ago.,203
1908,"The Basic Law, its value orientations and rights determine the central principles of living together in our country.",203
1909,"It formulates the foundations of our understanding of freedom, equality and justice.",201
1910,And it contains the permanent mandate to check again and again whether our society still lives up to these principles.,201
1911,The Basic Law states: Human dignity is inviolable.,203
1912,This explicitly refers to all people.,503
1913,We reject a Leitkultur debate because it is incompatible with the idea of freedom and equality.,201
1914,We consider the fight against right-wing extremism to be one of the most important tasks facing our society.,602
1915,The Basic Law goes on to say that property is an obligation.,203
1916,This also applies to the ownership of money and shares.,403
1917,"The economy and the financial markets must serve society, not the other way around.",403
1918,"This is not only a question of justice,",503
1919,"but also decides on the future of democracy, on the willingness of citizens to get involved for and in democracy.",202
1920,And the Basic Law states that men and women have equal rights.,503
1921,Any form of discrimination violates this principle of equality.,503
1922,This also applies to pay in the workplace.,503
1923,Democracy does not stop at the office door and the factory gate.,202
1924,Equality of opportunity and co-determination in the workplace are part of our social democratic tradition of democracy.,202
1925,They must be preserved and expanded.,202
1926,What we want,NA
1927,- Democracy does not come by itself.,202
1928,Democracy is not hereditary.,202
