,text,cmp_code
565,"In view of the many hitherto unused energy-saving or efficiency measures, we will push ahead with energy advice for consumers.",403
566,- More investment in energy efficiency.,411
567,"By 2020, we want to double energy productivity compared with 1990.",411
568,We will introduce a Climate Protection Investment Act that creates clear and reliable incentives in tax law for investments in energy efficiency and renewable energies.,501
569,We will use the proceeds from the auctioning of emission allowances for climate and environmental protection measures.,501
570,"We will include existing buildings in the obligation to use renewable energies in the case of renovation measures that are due anyway,",501
571,and at the same time provide further financial support for the use of renewable energies.,501
572,- National Renewable Energies Action Plan.,501
573,Renewable energies are one of the most important lead markets.,411
574,Technological advancement and application in one's own country are two sides of the same coin.,411
575,"We will present a National Renewable Energy Action Plan that will help accelerate the expansion of renewable energies in the electricity supply, heating and transport sectors.",404
576,We want to strengthen the priority of renewable energies in these areas.,501
577,We will also leverage our technological leadership in the use of wind energy at sea.,411
578,"We are aiming for an installed capacity of around 1,500 - 2,000 MW by 2013.",410
579,"In photovoltaics, we want to achieve near-grid parity by the end of 2013:",411
580,Electricity from a new plant in Germany will then only cost as much as electricity from the wall socket.,411
581,"By 2010, seamless and comprehensive certification systems will be established to ensure the sustainable cultivation of crops for bioenergy production.",501
582,- International dissemination of renewable energies.,501
583,We will work to ensure that the newly established Renewable Energy Agency (IRENA) quickly becomes a central player in the global spread of renewables.,107
584,"- Implement nuclear phase-out, ensure safety.",501
585,The use of nuclear energy poses too great a risk.,501
586,"Last but not least, the question of the final disposal of nuclear waste remains unresolved to this day.",501
587,The phase-out regulated in the Atomic Energy Act is enforced.,501
588,We are phasing out nuclear energy completely by 2021.,501
589,"Until the phase-out, the highest possible safety standards apply in all plants, with the obligation for continuous upgrading.",501
590,Extending operating lives would delay urgently needed investments in new technologies.,411
591,- Solution to final storage.,501
592,We maintain that no political preliminary decision must be made in favor of the Gorleben site for the final disposal of highly radioactive waste.,305
593,"Instead, we need a selection and comparison process that is open-ended and geared to international standards in order to find the best possible location in Germany.",303
594,"This has so far been prevented by the CDU, CSU and FDP.",305
595,- Involvement of the nuclear industry.,403
596,The necessary cleanup of the nuclear waste repositories in the former Asse II and Morsleben salt mines is causing high costs that should not be borne by the general public.,403
597,We will create the conditions for additional and appropriate participation by the energy companies in the nuclear industry.,403
598,"In the case of the Asse II repository, this explicitly includes the possibility of complete retrieval of the nuclear waste and its safe disposal.",501
599,- Efficient use of fossil fuels.,501
600,The use of coal and gas cannot be dispensed with in the foreseeable future.,408
601,We will ensure that the German and European climate protection targets are achieved,501
602,"and, at the same time, that German and European energy companies are given long-term planning security.",408
603,"Emissions trading is the central instrument for enabling new investments in state-of-the-art, efficient fossil-fuel power plants.",411
604,"We will adapt the licensing law to replace old inefficient coal and gas-fired power plants with new, more efficient power plants",501
605,and to ensure a decentralized flexible energy supply.,408
606,We intend to further develop carbon capture technology in Germany - including through European Union-funded demonstration projects.,411
607,"Reuse is to take precedence over final disposal, and companies must ensure the long-term safety of storage facilities based on the highest environmental standards.",501
608,Cogeneration is the most efficient form of energy production.,501
609,We will massively expand it to at least a 25 percent share of total electricity supply by 2020.,501
610,"For new power plants, we will give priority to environmentally friendly cogeneration.",501
611,We will ensure that citizens are fully involved in the approval process.,202
612,- The future of hard coal.,408
613,German coal mining has made a major contribution to the country's development and prosperity.,408
614,It has since been reduced to a low pedestal.,408
615,But it is sustainable.,408
616,"We therefore want the review clause for the German coal industry to be made effective in good time before 2012, thus preventing the de facto phasing out of hard coal mining.",408
617,- Energy research of the future.,411
618,We will expand energy research.,411
619,"As part of the 6th Energy Research Program, we will focus on energy efficiency, renewable energies and storage technologies.",411
620,Transport and mobility,411
621,- Mobility must remain affordable.,411
622,Mobility enables personal development and social participation.,411
623,"It is a prerequisite for participation in working life, education, culture and social life as a whole.",411
624,Mobility must therefore not become a luxury good.,411
625,"At the same time, transport policy also makes an important contribution when it comes to achieving our climate protection targets.",501
626,The fundamental goal of our modern transportation policy is to make socially and economically necessary mobility environmentally friendly and affordable.,411
627,- Modern infrastructure.,411
628,Mobility is also a lead market.,411
629,A well-developed transport system is an essential prerequisite for growth and employment.,410
630,Germany is the most important logistics location in Europe.,411
631,Investments in our infrastructure are therefore investments in our future.,411
632,We will continue them at a high level in the future.,411
633,"We place a particular focus on the expansion of environmentally friendly modes of transport, especially rail.",411
634,We will eliminate bottlenecks in road traffic with targeted investments.,411
635,"At the same time, we will press ahead with noise abatement.",501
636,- Optimal use of existing traffic routes.,411
637,We invest in modern traffic control technologies.,411
638,"By 2015, all highly congested highway routes are to be fully equipped with modern traffic control and traffic management systems to make better use of existing capacity on our highways and avoid congestion.",411
639,We will accelerate the introduction of the standardized European Train Control System (ETCS) to make rail more competitive in cross-border traffic. -,411
640,New technologies promote a move away from oil.,411
641,"To secure mobility in the long term, we need a technological leap forward in innovation.",411
642,The car will continue to play a central role in the future.,411
643,"On the one hand, efficiency in the use of fossil fuels must be further increased, e.g. through hybrid technologies.",411
644,"With a ""National Electromobility Development Plan,"" we want to drive forward the market launch of battery-electric drive technologies.",411
645,"At the same time, we are continuing our efforts to launch hydrogen and fuel cell technology on the market as part of the Clean Energy Partnership.",411
646,"Germany is to become a pioneer when it comes to ""getting away from oil"".",501
647,- For a strong and citizen-friendly railroad.,411
648,We want to shift more traffic from road to rail.,411
649,"In order to further increase the attractiveness of rail transport, we are focusing on an efficient rail network, attractive, barrier-free stations, good frequency of the various services and a customer-friendly, easy-to-understand fare system.",411
650,"The railroads must be strong, competitive and customer-friendly.",411
651,We reject the idea of breaking up Deutsche Bahn AG.,408
652,Deutsche Bahn is to remain an integrated group in the future.,408
653,We will ensure adequate funding for the railroads in the coming legislative period.,411
654,"That is why capital privatization does not take place, even partially.",413
655,- Safe and environmentally friendly mobility.,501
656,"We want to make urban transportation safer, more environmentally friendly and more socially responsible by introducing new technologies and expanding public transportation.",411
657,"We will treat public transport, cycling and pedestrians equally in our communities, making mobility safer for all.",411
658,- Fair distance allowance.,503
659,"We want to implement greater consideration of social and environmental aspects in the commuting allowance with the aim of ensuring that all commuters are treated equally and receive the same reimbursement per kilometer, regardless of income.",501
660,3. secure good work,NA
661,Work is the foundation of our prosperity.,408
662,We are the party of labor.,305
663,We have principles that correspond to the central importance of work:,408
664,- Those who work hard must get something out of it.,401
665,Performance must be rewarded this demand is right for all employees.,401
666,- Those who make an effort must be able to use it to improve their lives and must not face insurmountable hurdles.,401
667,Our society's promise of advancement holds true.,401
668,- No one must be left by the wayside.,503
669,We stand up for each other in solidarity and help those who cannot make a living with work alone.,503
670,We Social Democrats want everyone to have a job.,408
671,That's why we've improved job placement.,303
672,But good job placement also needs a growing economy and demand for labor.,410
673,We want to help make more jobs available.,408
674,There are two scenarios for the labor market of the new decade: Either we have sufficient skilled workers and low unemployment.,408
675,"Or we complain about a shortage of skilled workers and, at the same time, high unemployment figures.",408
676,The development can be shaped by us.,408
677,We want a completed vocational training or high school diploma for everyone.,411
678,Our goal remains full employment.,408
679,Our goal is Good Work.,701
680,"It must be fairly paid,",701
681,"must not make you ill,",701
682,must provide opportunities for further training,411
683,and family-friendly.,603
684,What we want: Defending and strengthening workers' rights,NA
685,- Preservation of employee rights.,701
686,Employees have social rights.,701
687,This is fundamental to a social market economy.,403
688,Protection against termination,701
689,and the right to elect works councils are indispensable employee rights for the SPD.,202
690,We protect these rights.,701
691,We need strong trade unions.,701
692,- Temporary employment: We will provide better legal protection for temporary employment relationships.,701
693,"In addition to a wage floor, this also includes strengthening the principle of ""equal pay for equal work"".",701
694,"After an appropriate training period in the same company, the principle of ""equal pay"" shall apply without restriction.",701
695,We want to limit intragroup lending.,701
696,- Internships must not become a dead end.,701
697,That is why we want better legal protection for interns against exploitation as cheap or even free labor.,701
698,- Employee data protection.,201
699,Numerous attacks in recent years have made it clear that we need our own employee data protection law that safeguards the rights of employees.,701
700,Such a project serves to bundle previously scattered regulations and to supplement them where new technologies create a need.,303
701,- Whistleblower protection.,201
702,"Employees are often the only ones who perceive violations of the law in the company, which may even pose risks to third parties.",701
703,We therefore want employees to be protected from employer sanctions if they point out grievances.,701
704,- Labor Contract Code.,303
705,We consider a Labor Contract Code to be welcome if it is drafted by consensus of the social partners,405
706,and completely and comprehensibly bundles the existing regulations without reducing employee rights.,701
707,- Protection of employees in the event of insolvency.,701
708,The economic crisis will continue to lead to an increase in corporate insolvencies in 2010.,408
709,We must therefore protect employees in insolvency proceedings as much as possible.,701
710,"It must be made clear by law that, in the event of insolvency, wages for work already performed may not be improperly withdrawn.",701
711,Fair wages and income,701
712,- Ensure collective bargaining autonomy and compliance.,701
713,We will defend the autonomy of collective bargaining in Germany and Europe.,701
714,It is a foundation for good work.,701
715,We want tariff compliance to become a central criterion in the awarding of public contracts.,701
716,And we support initiatives against social dumping in the European and international arena.,701
717,Good work must not be jeopardized by a globalizing labor market.,701
718,- Minimum wages.,701
719,"In the grand coalition, against the reluctance of the CDU/CSU, we pushed through an expansion of the Employee Posting Act and a revision of the Minimum Working Conditions Act to protect more sectors against dumping wages.",701
720,We are consistently pursuing this path.,701
721,We will enable generally binding collectively agreed minimum wages in as many sectors as possible.,701
722,And we will promote minimum working conditions wherever the social partners are no longer able to do so on their own.,701
723,Our goal is a general statutory minimum wage that marks a lowest limit below which wages may not fall.,701
724,A minimum wage commission is to set it.,701
725,We assume that a minimum wage of 7.50 euros is currently a sensible benchmark.,701
726,- Bonus for work.,701
727,We want to tackle a fundamental reorganization of the lower income bracket.,701
728,A statutory minimum wage will play the central role in this.,701
729,Taxes and social security contributions are coordinated with other government transfer payments in such a way as to strengthen full-time work that provides a living wage and is subject to social security contributions.,503
730,"We want to structure income supplements in such a way that no one, because he or she has children, slips into basic security for jobseekers.",503
731,"To this end, we want to further develop the child allowance in conjunction with the housing allowance in order to support working parents.",603
732,We want to create a right to choose between child allowance and housing benefit on the one hand and basic income support on the other.,503
733,- Strengthen employment subject to social security contributions.,701
734,We want to curb the expansion of insecure employment.,701
735,Good work means that employment subject to social security contributions is the rule.,701
736,We want to reintroduce the limit of 15 hours per week for so-called mini-jobs.,701
737,Equal opportunities equal pay for work of equal value,NA
738,- Equal wages.,503
739,Fair wages are unfortunately also still a question of gender.,503
740,We will ensure that the wage gap between men and women closes.,503
741,The minimum wage helps because many women still work in structurally low-paying fields.,503
742,We also want to set up an office that can initiate wage measurements at companies.,503
743,"At the same time, works councils are to be given the right to demand a statistical diagnosis from the employer as to whether wages in the company are fair.",701
744,"In addition, we want to anchor in the General Equal Treatment Act the possibility of the works council cooperating with this body.",503
745,This effectively extends the individual rights of the women concerned that already exist today in the event of a violation of the prohibition of discrimination.,706
746,"In addition, when awarding public contracts, only companies that treat women and men equally in terms of pay should be considered.",503
747,- More women in management and supervisory positions.,706
748,We will use binding regulations to ensure that women and men have equal opportunities for advancement in companies,503
749,and that the proportion of women in management positions is significantly increased.,706
750,"Following foreign examples, we want to introduce a 40 percent quota for women on the supervisory boards of companies.",706
751,- Advice on choosing a career and field of study.,706
752,We want to break down the gendered choice of careers and fields of study.,706
753,"This requires close cooperation between schools, vocational and academic counseling, and parents' homes.",706
754,- Part-time employment out of the impasse.,701
755,"With the Part-Time and Fixed-Term Employment Act, we have a legal entitlement to part-time employment",701
756,and opportunities to participate in vocational training.,411
757,"Nevertheless, the qualification and career opportunities of part-time employees are often still inadequate and the pay is not livelihood-securing.",701
758,Women are particularly affected.,706
759,We will take measures to improve the legal conditions for (re-)starting full-time employment,701
760,and offer more opportunities to participate in vocational qualification.,411
761,Training and opportunity for career advancement,NA
762,- Right to catch up on schooling for all.,506
763,"We will not tolerate up to 80,000 students leaving school each year without a diploma.",506
764,Each and everyone gets a second or third chance.,506
765,That is why we want the right to be able to catch up on school at any time with support.,506
766,We will ensure that students are prepared for vocational training with timely career guidance and career entry support while still at school.,506
767,- Strong dual system.,411
768,We will strengthen the dual system and modernize apprenticeships.,411
769,We want more training opportunities that combine in-company training with academic studies.,411
770,- Vocational training for all.,411
771,Vocational training is still the most important basis for starting a career.,411
772,"Even if we manage to get 40 percent of a year's intake into higher education, 60 percent will still be looking for traditional vocational training.",411
773,"Against this backdrop, we will continue to develop the training pact and aim to further increase the training place commitments of industry.",411
774,We provide apprenticeships for the less qualified applicants as well.,411
775,"With the apprenticeship bonus, we also help those who have been looking in vain for an apprenticeship for some time.",705
776,We want to give works councils the right of co-determination to push through more training places in their companies.,701
777,We want a vocational training guarantee for all those who are older than 20 and have neither a vocational qualification nor a high school diploma.,705
778,They should be given a chance in extra-company training programs where they can qualify in occupations with labor demand.,705
779,"In addition, we will enable young workers without training to catch up on their training in their company, if possible without loss of income.",701
780,We want to reorganize the transition from school to working life and turn waiting loops into clear paths from school to training.,411
781,- Easier access to higher education.,506
782,We want a permeable education system.,506
783,That is why we want to create the opportunity for vocational school students to also obtain a technical college entrance qualification.,506
784,"In addition, we want to increase the opportunities for integrated university studies and vocational training.",506
785,"In addition, we want to specifically open up access to colleges and universities for technicians, master craftsmen and other professionals with training.",506
786,"To this end, it should also be possible to receive BAföG after the age of 30.",506
787,- Securing the demand for skilled workers.,411
788,We want further education with a system and legal entitlements.,411
789,"At 43 percent, participation in continuing education in Germany is too low.",411
790,We want to increase this to at least half by 2015.,411
791,Low-skilled workers in particular should be able to participate more in continuing education.,705
792,"We want to keep the labor market open for foreign academics, graduates of German schools abroad and foreign students.",408
793,"We will also work hard to improve the qualifications of migrants, including language support and recognition of their foreign qualifications.",607
794,We want a recognition law on the basis of which everyone knows after six months at the latest which of their degrees acquired abroad will also be recognized in our country.,705
795,Employment insurance and lifetime work account,NA
796,- The long-term account a new model of work.,701
797,Employees want to be in control of their time.,701
798,We are creating the legal means to do this.,701
799,We have laid the foundations for this with insolvency protection and the transferability of credit balances from long-term accounts.,701
800,"We want employees to be able to save up credit balances and withdraw them flexibly over the course of their working lives for further training, raising children or caring for dependents.",701
801,These aspects can be regulated by the collective bargaining partners through industry-specific working time accounts.,405
802,"Together with the already established rights to part-time work in general and to part-time work when raising children, we enable a flexible approach to working time that is appropriate for every phase of life.",701
803,"From this, a new model of work can develop that combines flexibility and security requirements.",701
804,- Unemployment insurance becomes labor insurance.,701
805,"We want to develop unemployment insurance into an employment insurance system that not only ends unemployment quickly, but helps prevent it.",504
806,"To this end, we will establish a legal right to a free review of individual qualification needs for every employee nationwide.",701
807,This offer is to be provided close to home by the employment agency in cooperation with regional continuing education networks.,504
808,This qualification consulting can also be used by self-employed persons.,504
809,"With the new employment insurance, we want to help make long-term accounts for continuing education more attractive in companies.",411
810,"A publicly funded portion is to be paid into each long-term account, but it can only be used for qualification purposes.",504
811,Placement in work,NA
812,- Best placement in work.,303
813,We want Germany to have the best employment service in the world.,303
814,Anyone who becomes unemployed needs to know that the best possible support and placement services are open to him or her.,701
815,Combating long-term unemployment remains a key task.,408
816,We will increase the number of employment mediators in times of economic crisis to ensure that the placement service for each individual remains at a high level precisely when personal support needs are greatest.,701
817,- On-site support.,303
818,We will create a successor regulation for the labor pools of the Federal Employment Agency and municipalities that conforms to the constitution as quickly as possible.,303
819,Collaboration of placement expertise and local knowledge has proven effective.,303
820,- Improve funding instruments.,303
821,We will continue to improve the toolbox of employment services.,303
822,"In particular, we want to better promote business start-ups from unemployment.",402
823,"We will also focus on the integration of immigrants, who need even better support in integrating into the labor market.",705
824,New prospects have been opened up for the long-term unemployed with particular placement obstacles.,705
825,The Kommunal-Kombi for regions with particularly entrenched long-term unemployment will be further expanded.,504
826,- Needs-based standard rates.,503
827,People in unemployment should not be allowed to slip into poverty.,503
828,"There will continue to be a regular review of the standard rates of unemployment benefit II and, if necessary, an increase in line with requirements.",504
829,- Schonvermögen.,401
830,Retirement planning is important.,401
831,Assets used for private pension provision are not counted towards unemployment benefit II.,503
832,The prerequisite is that a monthly pension is irrevocably guaranteed from the start of retirement.,303
833,For a new culture of work - people- and family-friendly work,NA
834,- Humane working conditions to maintain employability.,701
835,Work takes up a large part of one's life time.,701
836,Work must therefore be designed in such a way that it is in harmony with the life cycle of the individual.,701
837,Employees must have the opportunity to work until retirement.,701
838,A new culture of work is therefore necessary in human and economic terms.,701
839,We will increasingly promote modern working conditions:,701
840,Companies can learn from each other.,701
841,"Model projects with social partners, companies and research are to help develop and identify good solutions for specific sectors.",405
842,- Humane working hours.,701
843,Work must also be organized in a way that is compatible with health.,701
