,text,cmp_code
1121,We are taking seriously the goal of the 2008 Education Summit to increase social spending on education and research to 10 percent of gross domestic product by 2015 and to make our country more sustainable in the field of education.,506
1122,"In order to be able to achieve this goal, we propose a surcharge as an ""education soli"" in the taxation of the highest incomes.",506
1123,"The top tax rate will be raised to 47 percent from a taxable income of 125,000 euros (married couples 250,000 euros).",506
1124,- Stock exchange turnover tax.,403
1125,"To curb short-term speculation, we want to introduce a stock exchange turnover tax modeled on the British stamp duty of 0.5 percent (standard rate) to 1.5 percent (special cases) of the market value on stock exchange securities transactions with a turnover of EUR 1,000 or more.",403
1126,"At the same time, we are working to ensure that such a tax is introduced across Europe and levied on further financial transactions.",108
1127,- Combating tax evasion and closing tax loopholes.,403
1128,"In Germany, many billions of euros are slipped past the tax authorities every year and shifted to tax havens.",605
1129,The states involved must be made to adhere to the international standards of information exchange in the taxation procedure.,107
1130,"If this willingness to cooperate does not exist and if the taxpayer himself also does not fulfill his duties to cooperate, it must be possible to impose sanctions, such as limiting the recognition of business expenses/advertising costs.",605
1131,Only with appropriate sanctions can the lawful enforcement of the tax claim be restored.,605
1132,"In future, anyone who evades taxes will also have to pay a significantly higher interest rate than the current six percent.",605
1133,These measures are expected to significantly reduce the previous volume of tax losses.,414
1134,- Combating sales tax fraud and organized crime.,605
1135,"Similar to international tax evasion, billions of euros are withheld from the taxpayer community each year in sales tax fraud, often through fraudulent ""carousel transactions.",605
1136,This criminal energy must be decisively countered and the search and audit pressure on sales tax fraudsters must be increased.,605
1137,6. welfare state progress and future,NA
1138,The welfare state is organized solidarity: it is,606
1139,"based on people standing up for one another - the strong for the weak, the young for the old, the healthy for the sick and those in need of care, the working for those seeking work:",606
1140,The community for those in need of help.,606
1141,It extends liberal civil rights to include social rights:,503
1142,"the major risks of life are covered on the basis of prior contributions social security is thus not a handout or dependent on arbitrary decisions, but there is a legal entitlement based on prior consideration.",503
1143,"To ensure that social security systems can continue to fulfill these tasks in the future, we must adapt them to changing conditions.",503
1144,The preventive welfare state is our model of organized solidarity.,503
1145,We want to see a modernization of social insurance that also responds to changes in the world of work.,503
1146,What we want: All for all. The principle of citizen social insurance,NA
1147,Citizens' social insurance as a guiding principle.,504
1148,Our social security system no longer meets the needs of a society with a longer life span and a changed working society.,503
1149,The restructuring of social security toward citizens' social insurance is our guiding principle far beyond one legislative period.,504
1150,"At the end of the process, there should be a welfare state that includes all citizens in solidarity when it comes to health and care coverage, and all working people in solidarity when it comes to old-age security and unemployment coverage.",503
1151,This idea presupposes a comprehensive social consensus for a citizen-oriented welfare state.,606
1152,"In the coming legislative period, we will take further steps in this direction.",503
1153,Solidarity pension scheme,NA
1154,- Stabilization of the existing pension system.,504
1155,"There is no better alternative to the pay-as-you-go statutory pension, supplemented by occupational and private pension schemes.",504
1156,The importance of the statutory old-age pension becomes particularly clear in times of financial crisis.,504
1157,"In order not to overburden any generation in an increasingly aging society, the changes in pension law were unavoidable.",503
1158,This also includes gradually raising the retirement age to 67 by 2029.,505
1159,"However, we also know that people are exposed to different burdens during their employment phase and that the labor force participation of older workers needs to be further improved.",701
1160,We also want to better meet people's individual needs in the transition between the working and retirement phases and,701
1161,prevent poverty in old age.,706
1162,"For us, it is clear that pensions must continue to be paid in return for the contributions paid during employment.",503
1163,- Maintaining employability.,701
1164,The central prerequisite of old-age provision is that people should be able to remain in working life for as long as possible under good conditions.,701
1165,We therefore want to use every opportunity to change the world of work in such a way that all employees can participate healthily in working life for as long as possible and,701
1166,that working conditions that are mentally and physically stressful are largely avoided.,701
1167,"- Good work"" for pensions that secure a person's livelihood.",701
1168,The prerequisites for poverty-proof pensions are living wages,701
1169,and an employment biography for men and women that is as unbroken as possible.,503
1170,That is why we are committed to minimum wages across the board.,701
1171,We will create an entitlement to subsidized employment subject to social insurance contributions for significantly underperforming long-term unemployed persons over the age of 60 in order to give this group the opportunity to participate in work and acquire pension entitlements.,705
1172,- Closing gaps in insurance biographies.,503
1173,Low wages and unemployment have led to gaps in insurance biographies in the past.,503
1174,We therefore want to reduce the risk that people who have been working for many years will have to rely on basic benefits in old age.,503
1175,"In order to better evaluate low pension entitlements for low-income earners, we will again extend the instrument of pensions based on minimum income for long-term insured persons for contribution periods until the end of 2010.",504
1176,Periods of long-term unemployment will be valued more highly to a limited extent if fewer than 30 earning points are available at the time of retirement.,504
1177,- Old-age provision in the second and third pillars.,401
1178,"The expansion of occupational pensions as the second pillar and of subsidized private pensions (""Riester pension"") as the third pillar is a success of social democratic policies.",401
1179,We want to improve coverage through these additional pillars.,503
1180,"In the future, the risk of disability is also to be covered on a mandatory basis and on the same terms.",504
1181,- Uniform pension system in East and West .,503
1182,"In the coming legislative period, we will push through a uniform pension system in the east and west.",503
1183,Promoting flexible transition from working life to old-age pension,NA
1184,- More flexibility in transition.,706
1185,"In the future, we want to give employees more flexibility in the transition from working life to retirement.",706
1186,- Subsidized partial retirement.,503
1187,We will extend the partial retirement program sponsored by the German Federal Employment Agency until 2015 if a company fills a vacant position with a trainee or training graduate.,701
1188,"In addition, we want to better meet individual and company needs within the framework of partial retirement.",503
1189,- Partial pension.,503
1190,We want to make it possible to claim an old-age pension as a partial pension while working part-time from the age of 60.,503
1191,- Additional contributions.,401
1192,Greater flexibility is also possible within the framework of pension insurance without burdening pension insurance with costs:,401
1193,"To this end, both the insured and the companies and collective bargaining funds are to be given the option of buying off the deductions with additional contributions to pension insurance in the event of earlier retirement, or of acquiring supplements to the pension and thus increasing protection in old age or in the event of reduced earning capacity.",401
1194,Expansion of pension insurance,NA
1195,- Inclusion of solo self-employed workers.,504
1196,The world of work has changed.,503
1197,"In today's employment biographies, transitions from dependent employment to self-employment or freelance work are more frequent than was the case in the past.",503
1198,That is why we want to develop the pension insurance system into an employment insurance system in the long term.,504
1199,"As a first step, we want to include all solo self-employed persons, unless they have a pension plan comparable to the statutory pension insurance in a professional pension fund.",504
1200,Citizen insurance for health and care,NA
1201,- More health for all.,504
1202,Equal health opportunities and solidarity-based coverage of the general life risks of illness and care for all people are essential prerequisites for freedom and for equal participation in society.,503
1203,"This contributes to a dignified life, a good quality of life, social prosperity, economic prosperity and thus social peace.",503
1204,"For us, improving and maintaining the health of all citizens is the task and responsibility of public services.",504
1205,- Involving all citizens.,503
1206,"With compulsory insurance for all, a fair equalization of the differently distributed social risks and the risks of illness (risk structure equalization) and the introduction of tax financing, we have taken important steps toward a solidarity-based health care system for all citizens.",503
1207,We want to continue on this path.,503
1208,- Solidarity-based financing.,503
1209,We want to use all incomes to finance health care and therefore increase the tax share for statutory health insurance.,503
1210,"Within the framework of the Health Fund, we want to further develop the new risk equalization system that takes into account different disease risks (''morbidity-oriented risk structure equalization'') and include private health insurance.",503
1211,"And we will ensure that the contribution to statutory health insurance, including the previous special contribution of 0.9 contribution rate points, is once again borne equally by employees and employers.",503
1212,We will introduce risk equalization between statutory and private long-term care insurance.,503
1213,"If all citizens participate on equal terms, the financing of long-term care insurance, including the necessary additional nursing and care staff, will be secured in the longer term without any increase in contributions.",503
1214,Good care for all,NA
1215,- Good supply in all regions.,503
1216,"We do not want two-tier medicine in the future, but rather good care to which all citizens in all regions have the same access.",503
1217,"In order to ensure uniform care and reduce overuse and underuse, we need further steps to make contracting more flexible.",303
1218,Collective and individual contracts together ensure sufficient nationwide coverage.,303
1219,"To make the fee system transparent and fair and to avoid discrimination against those with statutory health insurance, we want a uniform fee schedule for outpatient medical care.",503
1220,- Opening up hospitals to outpatient care.,503
1221,We want to further open up hospitals to outpatient care.,503
1222,We want to pay the same for the same services regardless of where or for whom they are provided.,503
1223,This must not lead to distortions as a result of the different financing arrangements for outpatient and inpatient care. -,503
1224,Building on successful reforms.,303
1225,"With the healthcare reform of 2007, we laid the foundations for a modern, efficient and fair healthcare system.",303
1226,and a fair distribution of contribution funds.,503
1227,"Despite necessary compromises, we have ensured that co-payments have not been extended",504
1228,and that all people will continue to have access to the necessary medical care based on the latest medical knowledge.,503
1229,- Participating in medical progress.,503
1230,Our goal is and remains that all people should be able to participate in medical progress.,503
1231,"In view of this progress and the associated society of longer life, we must ensure that contributors' money goes exactly where it is needed.",303
1232,Only the responsible use of the available resources by all players will ensure a good future for our healthcare system.,303
1233,"We will align further reforms, in particular of the institutions of the healthcare system, with this.",303
1234,- Medical care close to home.,503
1235,"In a society of longer life, the participation of all must also be ensured in the health care system.",503
1236,"This includes outpatient care close to home by general practitioners and specialists in private practice,",503
1237,"ensuring the free choice of doctors,",503
1238,and strengthening the cooperation of general practitioners and specialists working in outpatient care with hospitals and nursing facilities.,503
1239,Ensuring quality Strengthening patients,NA
1240,- Future of the Health Professions.,408
1241,The healthcare professions also need to change.,408
1242,"It is left to the free choice of physicians whether they want to work independently or as employees, in private practice or in a medical care center.",704
1243,Medical and non-physician medical professions need to collaborate more than they have in the past so that everyone in the health care system can contribute their expertise in the best possible way.,303
1244,"Flat hierarchies, relief of doctors from bureaucratic tasks by specialized assistants and more technological support, more competencies for nursing professions are the way of the future.",303
1245,A very special challenge arises from demographic change:,706
1246,"for all health care professions, geriatrics and palliative care must become an important focus in training, research and work.",706
1247,We want to take gender into account in the healthcare system through gender-specific research and care.,503
1248,- Expansion of integrated care.,503
1249,Every patient must be assured that all parties involved in their treatment are working together reliably and pursuing coordinated treatment strategies.,503
1250,"To this end, we want to expand integrated care and ensure its financing.",504
1251,The same applies to the care of chronically ill people through guideline-supported and evidence-based treatment programs.,504
1252,- Neutral benefit assessment of services.,303
1253,"Expanding the cost-benefit assessment of new drugs and therapies, as well as the provision of patient-friendly information by neutral institutions, will help strengthen the economic efficiency of the healthcare system.",303
1254,- Strengthening prevention.,504
1255,"A preventive health policy includes the prevention of diseases, the",504
1256,"realization of health-promoting living, housing and working conditions,",503
1257,and the equalization of social differences in health opportunities and life expectancy.,503
1258,"With a Prevention Act, we want to strengthen primary prevention and define health targets as a framework for action.",503
1259,"It must start with social living environments (urban neighborhood, workplace, school, etc.).",503
1260,"The federal, state and local governments, the social insurance institutions and private health insurance must be included in the responsibility for financing.",303
1261,"Work intensification and insecure employment can make people ill: not least, therefore, the commitment to good work is an important contribution to a preventive health policy.",701
1262,- Patients' rights.,705
1263,An efficient health policy that is geared to the needs of the people requires better and more transparent patient rights.,705
1264,"This also includes bringing together the hitherto fragmented and non-transparent rights of patients in one law,",303
1265,"and strengthening them in particular with regard to error prevention and risk management, as well as regulation in the event of damage occurring.",705
1266,"In addition, we will place the independent patient advice centers on a permanently secure financial footing.",503
1267,- Healthcare as a growth sector.,410
1268,The social healthcare industry is one of the strongest employment sectors in Germany.,408
1269,The growth potential is enormous.,410
1270,Investments in health are investments in the future.,408
1271,Humane care,NA
1272,- Quality of care.,504
1273,"With the 2008 care reform, we significantly improved the services for people in need of care, especially those suffering from dementia, and their relatives",504
1274,and laid the foundations for greater care quality and transparency.,303
1275,Outpatient care in particular will be strengthened by the new opportunities for family members to take over care while being released from work for a limited period and receiving full social security (care leave).,504
1276,The new one-stop care advice service in the care support centers also makes a contribution to this.,504
1277,- New definition of need for care.,705
1278,"With the further development of the definition of the need for long-term care, we will gear the assistance provided by long-term care insurance more precisely to the individual needs of those in need of care.",705
1279,"We want to move away from ""minute care"" to care that perceives the person as a whole and aligns the need for help with the degree of restriction of independence.",705
1280,- Services close to home.,503
1281,"Together with the states and municipalities, local assistance must be further developed in the coming years so that people in need of care and their relatives have access to support services close to home everywhere and home care can be strengthened.",503
1282,- Exemption claim.,503
1283,We want to introduce a paid leave entitlement from work of up to 10 days for close relatives so that they have the time they need to organize care in the event of an acute need for care.,503
1284,7. strengthen families Enable equal opportunities for every child,NA
1285,"In the family, the principle of solidarity applies:",603
1286,everyone stands up for the other.,603
1287,Families also deserve this solidarity from society.,603
1288,We need to give young couples security and freedom so that the desire to have children can be realized.,603
1289,"Families need a child-friendly environment: at work, at home, in the city.",603
1290,They need a good support infrastructure to ease the burden of everyday life and the certainty that they will not be left alone with their task.,503
1291,"Family is the place where marriage and partnership are lived, where spouses and partners agree on how to divide gainful employment and childcare, and where equality becomes concrete.",603
1292,We have done a lot to achieve this in recent years:,503
1293,"parental allowance, legal entitlement to a childcare place from the first birthday and all-day schools give more families more freedom to make decisions",503
1294,and to manage tasks in partnership.,503
1295,That is why we want to make our tax system gender-equal so that it does not represent a hurdle for women to become gainfully employed and does not stand in the way of their professional emancipation.,503
1296,Single parents have to do more every day than others to organize their daily lives.,503
1297,"In this task, they deserve the special support of society.",503
1298,No child should grow up in poverty.,503
1299,"Unfortunately, this is not yet a reality.",503
1300,The best protection against child poverty is a living wage employment of the parents.,408
1301,"To combat child poverty, we want intensive coordination of child, youth, social and education policy instruments across political levels.",303
1302,We want a child- and family-friendly society.,603
1303,"What we want: Families need more time, financial support and better infrastructure",NA
1304,- Better child care.,503
1305,We have succeeded in ensuring that every child has a legal right to care from their first birthday from 2013.,504
1306,This legal entitlement is to be expanded into an entitlement to all-day care.,504
1307,We want an improvement in the quality of childcare.,503
1308,- Parent-child centers as a regular offer and in every location.,503
1309,We want to expand daycare centers to parent-child centers.,503
1310,They provide comprehensive help and advice for parents.,503
1311,- National Children's Conference.,706
1312,"In order to make rapid progress on all issues relating to the expansion of childcare, we want to set up a National Children's Conference.",303
1313,- Improve parental allowance and partner months.,504
1314,We want to further develop parental allowance and the partner months in such a way that the division of labor in the family as partners is promoted even more than before.,503
1315,We want mothers and fathers to be able to claim parental allowance and parental leave at the same time.,504
1316,"To this end, we want to increase the number of partner months from two to four (''12+4 model'')",504
1317,and extend the simultaneous entitlement to part-time employment and parental allowance from seven to sixteen months.,504
1318,- Targeted support for single parents.,503
1319,Parents who raise their children alone cope with special burdens and bear an increased risk of poverty with their children.,503
1320,"In addition to expanding childcare in line with demand, we want to help them with targeted measures.",503
1321,"This includes specialized support in the employment agencies, which is better networked than before with child and youth welfare and other support systems.",503
1322,We will help low-income families to make use of personal and household-related services.,503
1323,- Advance maintenance payments.,503
1324,The situation of single parents has been precarious for years.,503
1325,That is why we will make the conditions for the advance on maintenance payments flexible and thus improve the situation of single parents and their children.,503
1326,"The federal, state and local authorities will agree measures to ensure that advance payments are consistently reclaimed from debtors in future.",303
1327,Equal opportunities for all children and young people: Action plan against poverty,NA
1328,- Action plan against child poverty.,503
1329,"To combat poverty among children and young people, we need a coordinated policy between the federal, state and local governments.",503
1330,The main causes of poverty are unemployment or insufficient earned income of parents.,408
1331,"In addition to material poverty, unequal educational opportunities are a threat,",503
1332,health impairments,503
1333,and social exclusion affect the development of children and young people.,503
1334,"That is why we will implement a coordinated action plan against child and youth poverty, combining measures from all policy areas into an integrated strategy.",503
1335,Particularly important are: - Good work for the parents.,408
1336,"Placement in good work and qualification, a statutory minimum wage, better reconciliation of family and career, and further development of child allowance and housing benefit are crucial in protecting families from poverty.",603
1337,- Equal educational opportunities.,506
1338,"Every child must be supported from the very beginning, regardless of his or her social background.",503
1339,"Together with the states and local authorities, we are committed to integrative forms of schooling and the expansion of all-day schools.",506
1340,And we want to give young people the right to catch up on their schooling.,506
1341,We stand for free education from kindergarten to university.,506
1342,- Basic security for children.,504
1343,"We have achieved a great deal with the school starter package, the one-off child bonus and the introduction and increase in the standard rate for basic benefits for 6 to 13 year-olds.",504
1344,"We want to improve independent, needs-based child rule rates by determining needs more precisely.",504
1345,Children and youth policy,NA
1346,- Children's rights in the Basic Law.,706
1347,"To give children a stronger voice in our society, we want to include children's rights in the Basic Law.",706
1348,- An independent youth policy.,706
1349,Adolescence is a special phase of orientation and the formation of one's own personality.,706
1350,"The demands on today's young generation have increased due to social, economic and demographic changes.",706
1351,We want to address the special needs of young people with a strong youth policy.,706
1352,- Promoting voluntary engagement.,606
1353,Youth Volunteer Services are a special form of civic engagement and an educational year.,606
1354,We will strengthen youth volunteer services.,606
1355,"In the medium term, we want to offer a place to all young people who want to complete a voluntary ecological year or a voluntary social year.",606
1356,We reject a general compulsory service for young women and men.,706
1357,- Growing up healthy.,503
1358,We are committed to ensuring that all children and young people can grow up healthy.,503
1359,That is why we will expand health promotion and prevention into an independent pillar of the health care system.,504
