,text,cmp_code
0,Social and Democratic.,NA
1,"Tackle. For Germany. SPD Government Program 2009 2013 Adopted at the Extraordinary Federal Party Congress in Berlin on June 14, 2009.",NA
2,I. A new decade 1. Time for decisions,NA
3,"On September 27, 2009, it will be decided who will govern Germany for the next four years.",305
4,Who people confide in.,305
5,Who they trust to lead our country safely through the crisis.,408
6,That it fights for jobs and strengthens the forces of growth.,408
7,"That it has a clear compass, holds its course in turbulent times and provides security.",305
8,But much more is decided.,000
9,It will be decided what happens after the crisis in our country.,000
10,Whether this will lead to a move towards more democracy,202
11,and new common ground.,606
12,Whether a sense of responsibility and reason will regain the upper hand.,403
13,Whether we learn the right lessons from the global financial and economic crisis and set rules and limits to market forces.,403
14,"Whether we create a sustainable Germany that strikes a balance between economic, social and environmental goals.",416
15,It will determine whether we want to be a society of solidarity in which the strong bear greater burdens and the weak are given real opportunities to become strong.,503
16,And whether the many people who have come to us will find a good home in our country with their children.,607
17,Many say: This crisis was an industrial accident.,000
18,"Let's fix it, then it will be business as usual.''",000
19,This view is wrong!,305
20,Because this crisis is more than just a normal economic slump.,305
21,It is the result of an ideology that focuses on maximum profit and not on people.,403
22,And that's why our response must be more than a stimulus package.,408
23,We conclude: The market-radical age has failed.,403
24,We are at a turning point in time.,305
25,Answering the distribution questions in a social democratic sense strengthens our democracy,202
26,and our social market economy.,403
27,We Social Democrats want social democracy.,503
28,"And that also means the welfare state and the social market economy in Germany, in Europe and worldwide.",403
29,The economy is there for the people and not vice versa.,403
30,We Social Democrats invite all people to join us on the path of renewal.,305
31,Because that's what it's all about: Powerful renewal for our country!,305
32,Our government program is an offer to the whole of society.,305
33,"It is aimed at all those who want to make our country better, fairer and more humane.",503
34,To all who are committed to the principles of fairness and solidarity.,503
35,"To all citizens, we say: We know how hard you work for yourselves and your families.",701
36,"We make you a fair offer: more support for families and for better kindergartens and schools,",603
37,a simpler tax system.,303
38,We want older people to be able to participate in public and political life without restriction and to contribute their life experience.,706
39,We know that some need help.,503
40,We do not leave anyone alone.,503
41,"We want all people to be able to lead a self-determined life, to",503
42,have a fairly paid job,701
43,and to be able to advance through education.,503
44,We know that there are many long-term thinking entrepreneurs and managers for whom performance and responsibility go hand in hand.,704
45,We want to work with them to ensure that the economy serves people.,403
46,Help make our education system better.,506
47,And let's work together to renew the economy and create sustainable jobs.,408
48,We are being presented with a historic opportunity that comes perhaps only once in a generation.,403
49,We can re-found the idea of the social market economy.,403
50,And we want to take advantage of this opportunity.,403
51,We Social Democrats have shown over the past ten years in government that we have the courage to take responsibility.,305
52,We have not dodged difficult decisions.,305
53,"Since 1998, we have courageously opened the windows and changed the country for the better:",305
54,- Germany has proven itself as a peace power in Europe and the world.,106
55,- Germany has become more modern and more open to the world - the stale atmosphere of the Kohl years has been overcome. -,305
56,Germany is an international pioneer in the fight against climate change,501
57,and has decided to phase out nuclear energy.,501
58,- Germany has made its social security systems fit for the future through courageous reforms.,503
59,We have not done everything right during this time and have not yet achieved some things.,305
60,"But our compass is intact, the direction is right.",305
61,Now we're taking another run at it.,305
62,Anniversary Year 2009: Remembering and Looking Forward,NA
63,This year we remember and we look forward.,000
64,"Twenty years ago, courageous men and women in eastern Germany made the unification of our country possible through their peaceful resistance.",601
65,"Much has been achieved in recent years, and much remains to be done.",305
66,We want to complete social unity and take the steps resolutely.,606
67,"60 years ago, after the terrible terror of the Nazis and the war that started from Germany and devastated Europe, our country was also rebuilt.",000
68,"With the Basic Law, we have a democratic constitution that is a living, demanding and humane foundation for our coexistence.",203
69,The Basic Law determines the principles of our coexistence.,203
70,No one is allowed to get behind that.,203
71,It doesn't get any clearer or better than that:,203
72,- Human dignity is inviolable.,201
73,- The freedom of the person is inviolable.,201
74,- All people are equal before the law.,201
75,- Men and women have equal rights.,503
76,- Everyone has the right to express his or her opinion freely.,201
77,- Property is an obligation.,403
78,- We are a democratic and social federal state.,202
79,We want a country and a society that live by the rules of the Basic Law and that give respect to these rules where it proves necessary.,203
80,2 Ownership obligates: The Social Market Economy,NA
81,We face daunting tasks.,305
82,Irresponsible and in some cases unscrupulous actions on the international financial markets have plunged the world into a severe economic crisis.,403
83,"Germany, as one of the most important industrialized countries, is not spared.",408
84,Millions of workers around the world and countless companies are now having to pay for what others have left behind in their heedless pursuit of profits.,701
85,The task of policymakers is to manage the consequences and prevent a repeat of this crisis.,403
86,Security and justice: acting in the crisis,NA
87,"With the rescue package for the financial market, we secured the supply of credit to the German economy and prevented a collapse.",412
88,"At the same time, Frank-Walter Steinmeier has taken the initiative for a protective umbrella for jobs.",701
89,- Creating security.,412
90,"At our initiative, the German government has guaranteed private savings deposits.",412
91,No one has to worry about their savings.,412
92,- Setting impulses.,410
93,"With the two economic stimulus programs totaling more than 80 billion euros, we are providing a strong impetus for growth that will be felt above all in the municipalities",410
94,and secure jobs in small and medium-sized enterprises.,403
95,- Securing jobs.,408
96,We fight for every job.,408
97,The extension of the short-time allowance has secured hundreds of thousands of jobs in Germany.,408
98,We promote the qualification of employees.,411
99,Qualify instead of dismiss - that is our principle.,411
100,We will massively expand the offerings for continuing education.,411
101,Qualified workers have a better future.,411
102,- Supporting the unemployed.,701
103,We care for those who lose their jobs.,701
104,We want them to get back to work as soon as possible.,701
105,We therefore need more mediators at the employment agencies and job centers - and better mediation.,701
106,Qualification opportunities for job seekers must be deployed swiftly and in a targeted manner.,411
107,"Where companies are unable to prevent job cuts despite their best efforts, transfer companies help.",405
108,They are the social partnership way for employees to reorient themselves on the labor market.,405
109,We will therefore ensure that employees in transfer companies receive intensive support and training.,411
110,All support instruments of labor market policy must be open to them.,701
111,- Sharing the burden fairly.,503
112,The burden of the crisis must not be placed unilaterally on citizens.,503
113,We need solidarity-based burden sharing that allows those responsible for the crisis and the wealthy to share in the financial burden.,503
114,- Enforce new rules.,403
115,The financial markets need new rules.,403
116,Greed must be stopped.,403
117,We have pushed through initial rules in the national framework,403
118,and are now also achieving progress in the international framework after many years of efforts by social democratic finance ministers.,107
119,But there will be a long way to go before the primacy of politics is established.,404
120,"Now it is proving that we Social Democrats and Social Democrats have always placed our faith in Germany's industrial base and, unlike parts of the CDU/CSU and the FDP, have never questioned its character as an industrialized country.",411
121,The fact that we have focused on innovation and the consistent modernization of our economy is now proving its worth.,411
122,Now it is proving that we have made the German labor market more crisis-proof through reforms.,408
123,"But: Politics must not only repair, politics must act with foresight, recognize the causes of the crises and eliminate them.",404
124,"Market radicalism has failed worldwide, and with it the policies of significant sections of the CDU/CSU and FDP.",403
125,Restart of the Social Market Economy,NA
126,"The hunt for ever higher returns, the short-term orientation in parts of the economy, the immoderateness in personal remuneration has been declared normal for many years.",403
127,There should be no limits to greed.,403
128,Market radicalism has declared this malaise to be the basic condition of economic activity.,403
129,"Any attempt to impose rules, transparency and control was denounced as false interference in the free play of forces.",403
130,"We rely on the democratic state, which is capable of acting and sets clear rules for the social market economy.",403
131,A reboot of the social market economy must be a response to the unleashed capitalism of the 21st century.,403
132,"For us, the social market economy means more than just regulatory policy.",403
133,We base a genuine new start on ten fundamental principles:,403
134,1. markets must be embedded in a strong and solidarity-based society.,503
135,Our economy needs a society of equal rights and equal opportunities.,503
136,"The productive interaction of state, market and society, involving employers, employees and trade unions, is the basis of the social market economy.",405
137,"Today, it is clear that co-determination in companies and enterprises is an indispensable, stable success factor.",202
138,2. an effective state that offers citizens security and guarantees strong public services.,503
139,It is the primary task of the state to create the basis for individual opportunities and social prosperity through good education.,506
140,An efficient public service is the prerequisite for a reliable public infrastructure and public services.,303
141,"For this, the state needs reliable revenues and consolidated finances. 3.",414
142,3. fair participation of employees in society's prosperity and a fair distribution of income and wealth for social and economic reasons.,503
143,"4. the principle of ""investment instead of speculation"".",408
144,"Article 14 of our Basic Law states: ""Property obliges"".",203
145,"Therefore, rules are needed to ensure that capital is used ""productively"" and serves the interests of the common good.",403
146,"Through strategic and ecological industrial policy, the state has opportunities to create incentives for capital to flow into sustainable, ecologically compatible growth areas. 5.",408
147,5 Public investment in the future plays a central role in combining economic and social innovation with social justice.,503
148,Germany is a strong export nation and should remain so.,408
149,But equally important is the purchasing power within.,408
150,We need a balance of export strength and domestic market.,408
151,7. a culture of long-termism and sustainability.,403
152,A social market economy does not stand in the way of a dynamic economy and free enterprise.,403
153,"But one of its essential tasks is to set the framework and incentives for market participants in such a way that economically, socially and environmentally sustainable behavior pays off more than non-sustainable behavior.",403
154,8. fair competition for better ideas and products.,403
155,"Where there is competition for low wages and poorer working conditions, everyone loses in the end.",403
156,We need a new phase of cooperation instead of just competition. 9.,403
157,"9. the guarantee of social civil rights through solidarity-based social insurance,",503
158,a tuition-free education system,506
159,and a minimum wage for work.,701
160,We also want to enforce these basic principles of a social market economy at the European and international level.,107
161,Some of this has been called into question in the recent past.,403
162,"But ""turning point"" means that today is about nothing more and nothing less than a new start for the social market economy in Germany, in Europe and internationally.",403
163,Such a new start requires overcoming an often market-radical narrow view of the economy.,403
164,This is not only the task of politics.,405
165,"We Social Democrats want to engage in a social debate with trade unions and employers, with academia and associations, about how we envision a social market economy in the 21st century.",405
166,"This also includes making economic policy advice more practice-oriented, pragmatic and international.",303
167,3. Germany is strong Our country is strong.,NA
168,We are strong also in change.,601
169,We have mastered difficult challenges over the past decades and together we have brought our country up to date time and again.,601
170,We are able to do this because we provide security with the welfare state and organize solidarity in the country.,503
171,Because we give the market moral goals and fair rules.,403
172,And because we are a lively and active social society in which many people get involved and lend a hand.,606
173,"In view of the historic depth and severity of the financial market and economic crisis, we will have to examine in the fall, on the basis of the economic data valid at that time, which of our proposed measures can be implemented immediately and which can only be implemented in the course of the legislative period.",414
174,Progress is our goal.,411
175,progress to achieve and sustain a high level of prosperity for all.,408
176,"Socially just, fairly distributed,",503
177,sustainable and ecologically responsible.,501
178,Germany needs new common ground.,606
179,We contribute to this with our policies.,305
180,Commonality is a key driver of social progress in our country.,606
181,This succeeds when everyone contributes and the rules apply to everyone.,503
182,No one should shirk responsibility.,503
183,Our Germany should be a country where fairness applies.,503
184,4. our goals Frank-Walter Steinmeier: a social democratic chancellor.,NA
185,Frank-Walter Steinmeier is to be Chancellor of the Federal Republic of Germany.,305
186,The fourth social democratic in our history.,305
187,"Three Social Democratic chancellors before him helped shape the republic, taking responsibility and demonstrating courage in difficult times.",305
188,They have served the country well and moved it forward.,305
189,"With his Ostpolitik, Willy Brandt laid the foundation for overcoming the confrontation between the blocs.",305
190,He dared more democracy.,202
191,Helmut Schmidt steered our country through difficult times with a clear course and sensibly linked the economic and the social.,305
192,"Gerhard Schröder saved our country from the Iraq war, initiated the phase-out of nuclear energy and the energy turnaround, and put Germany on the right track with a determined reform policy.",305
193,We need a social democratic chancellor again in the coming years.,305
194,A chancellor who leads with clear convictions and not just moderates.,305
195,A chancellor who has the courage to make decisions.,305
196,Prosperity for all at a high level permanently,NA
197,- We will succeed if we guarantee the performance of our country,408
198,and make good work for all the central political goal.,701
199,The potentials are there.,408
200,In companies and among skilled workers. - We will succeed if,408
201,- We will succeed if the coming decade is the decade of investment in education and training.,506
202,and research.,411
203,- We will succeed if our policies are guided by the principle of sustainability.,416
204,We are also jointly responsible for future generations.,706
205,"Work, education and sustainability: these are the drivers of progress in the coming period.",408
206,We are a democratic and social constitutional state and want to remain so.,202
207,"To achieve this, a social welfare state capable of taking action is indispensable.",503
208,"It is sustainable and superior to other models that seek to privatize coverage in old age, in the event of illness or in the event of long-term care.",503
209,The social market economy is our way.,403
210,"Focused on prosperity, committed to social welfare, indispensable, not only in our country but also in Europe and worldwide.",403
211,Social partnership is the joint responsibility of entrepreneurs and trade unions.,405
212,It makes a decisive contribution to social and internal peace in Germany.,405
213,The social society is the field in which citizens take on responsibility particularly intensively and actively participate.,606
214,The social city is the place to live.,503
215,"Home, starting point for a mobile life, place where quality of life is experienced and learned.",503
216,This is our Germany.,601
217,A country that peacefully assumes its place and responsibility in Europe and the world.,106
218,The new decade presents us with many tasks.,305
219,But eight goals are central to us:,305
220,"everyone should have a job, fairly paid.",701
221,"Because work plays such a central role, full employment remains a goal that a social market economy does not abandon, because it gives its citizens the prospect of personal development and prosperity even in difficult times.",701
222,"For this, we need successful companies",401
223,and strong workforces.,701
224,All young people should have a high school diploma and educational qualifications.,506
225,Fair educational opportunities for all are the basis for social justice in general.,506
226,Education is a human right.,506
227,No child should be left behind by society.,503
228,Climate change challenges us all.,501
229,"Sustainable living and economic activity is no mere utopia, but the prerequisite for future generations to be able to live well in the future.",501
230,"We want to achieve the climate goals and advance the comprehensive ecological modernization of the infrastructure, buildings, capital stock in our country.",501
231,Germany is to become the world's think tank on climate protection - and this will create new jobs.,501
232,We want to strengthen families.,603
233,They are the most important social unit in our society.,603
234,We want to shape the conditions in such a way that cohesion between the generations is sustainable.,603
235,Families need reliable structures.,603
236,"They should be socially secure, parents should be able to combine work and family.",603
237,The children must be protected.,706
238,We want to significantly improve the situation of single parents.,503
239,We want to further promote equality between men and women in all areas of society.,503
240,"This includes equal participation in living wage work and career advancement opportunities, as well as equal pay for work of equal value, and the sharing of family responsibilities on a partnership basis.",503
241,Equality must lead to equal treatment and actual equality.,503
242,Integration is a central task for the future viability of our country.,607
243,Their success is decided in the cities and communities.,301
244,We want and need to reach out to children and young people in particular.,706
245,"They need special support so that equal opportunities are possible in kindergarten, at school and at work.",503
246,"In the first global century, Germany cannot and will not act alone, but as an important part of Europe.",108
247,"This Europe should not only be economically strong, but also have a clear social order.",108
248,"Internationally, Europe stands for peace, cooperation and a fair balance of different interests.",108
249,We do not need to reinvent our economic and social model.,403
250,The social economic order as the economic order of a social democracy has proven its worth.,403
251,The social market economy is the success model of our prosperity and our democracy.,403
252,It has made Germany strong and it can continue to do so in the future.,403
253,"In the 60 years of our Federal Republic, social democracy and the trade unions have played a decisive role in shaping it.",403
254,But it must now be restarted.,403
255,It needs fresh impetus and decisive action.,403
256,II. our policy 1. maintain and secure prosperity,NA
257,The global crisis has also hit the German economy hard.,408
258,"With two extensive economic stimulus programs, we have built bridges to support our economy.",412
259,and our labor market well through the crisis and give ourselves the opportunity to start the next upswing stronger and more crisis-proof than before.,408
260,"With this policy, we are building on the reforms of the two Social Democratic-led federal governments, which helped make Germany the most competitive country in the entire European Union today.",403
261,"The talk of the ""sick man of Europe"" is long gone.",601
262,Now we are back in a top position internationally.,408
263,We want Germany to be a country of high prosperity in the long term.,408
264,"The sources of prosperity are above all qualifications, ideas, knowledge, creativity, well-trained specialists and curiosity about new things.",411
265,Germany is a frontrunner in key technology fields.,411
266,We want to maintain and expand this position.,411
267,"For us, economic competence, especially in and after the crisis, means keeping an eye on the economic big picture.",408
268,We want an economy that stands on two stable pillars:,408
269,"an innovative, productive export sector",411
270,and a strong domestic market.,408
271,That is why we are pursuing an economic policy that strikes a new balance between the key economic objectives:,408
272,more targeted public investment,412
273,and a reduction in public debt.,414
274,International competitiveness,408
275,and strong domestic demand through equitable income distribution.,409
276,Growth,410
277,and environmental sustainability.,501
278,That is why a good education,506
279,"and research policy,",411
280,a policy that ensures efficient infrastructure,411
281,"and enforces the rules for fair competition, is the best and most successful economic policy in the long term.",403
282,What we want: New rules for the financial markets,NA
283,- Rules for banks.,403
284,Financial service providers must return to their serving function for society and the real economy and assume more responsibility for risks.,403
285,"In the future, there must be no more off-balance sheet transactions.",403
286,"Improving the equity base of companies is one of the goals of our capital market policy, especially in times of crisis.",403
287,We continue to reject short-term and speculative investments at the expense of sites and jobs and are,403
288,taking internationally coordinated initiatives for transparency and control.,403
289,Assets must be able to be valued in such a way that they do not have a procyclical effect and thus exacerbate the crisis if the market changes significantly.,403
290,- Regulation of hedge funds and private equity funds.,403
291,Both types of funds operate with high risks and therefore need to be more strictly regulated.,403
292,"We call for registration and complete monitoring of hedge funds and private equity at the European and international level,",403
293,"an improvement in transparency,",403
294,"and higher capital requirements, including for lending to the funds.",403
295,We want rules against excessive corporate debt by funds.,403
296,Banks may only transact with registered funds.,403
297,"It must be possible to prevent harmful short selling, which is used primarily by hedge funds.",403
298,- More independent rating agencies.,403
299,We want to break away from the dependence and dominance of a few American rating agencies.,403
300,This can best be done at the European level.,108
301,We advocate effective registration and clear rules to prevent conflicts of interest and transparency in and by credit rating agencies.,403
302,We want to reduce the importance of rating agencies as part of the necessary reorganization of financial market regulation.,403
303,- Strong financial market supervision.,403
304,Stable financial markets are a public good.,403
305,"There must be strong financial market supervision capable of action at national, European and international level:",403
306,"no market, no product, no actor, no territory and no state must remain unsupervised in the future.",107
